title,review,rating,date,developerResponse
알아서 관리해주는 스마트한 친구,평소에 투자를 시작하면 금액이 적고 많고를 떠나 늘 폰에서 눈을 못땠었는데 로보어드바이저를 통해 알아서 관리해주고 위험할때면 자동으로 리벨런싱까지 도와주니 편하게 일상생활을 할 수 있게 되었어요!,5,2021-12-22 14:54:57,"안녕하세요, 되지감자님! 쿼터백입니다. 쿼터백 서비스를 통해 일상 생활에 더 집중하시는 변화를 경험하신 것 같아서 정말 보람차고 기쁩니다. 급변하는 시장 속 에서도 마음 편히 투자하실 수 있도록 최선을 다하는 쿼터백이 되겠습니다. 새해 복 많이 받으세요! 쿼터백 팀 드림."
재테크 초보에게 추천해주고 싶은 어플,재테크 초보에게 추천해주고 싶은 어플이에요!! 내가 크게 신경써야할 부분이 없게끔 자동으로 리벨런싱해줘서 좋습니다. 앞으로 더 다양한 테마가 나오고 테마별로 투자 할 수 있게 제한 사항을 풀어주면 더 좋을것 같아용👍👍,5,2021-12-22 12:21:20,"안녕하세요 johy0306님, 쿼터백 입니다. 테마형 투자 서비스에 만족하시고 이렇게 힘이 되는 리뷰를 남겨주시니 정말 감사하고 뿌듯합니다. 쿼터백의 테마형 투자 서비스는 1~2개의 단일 ETF로 구성하기 어려운 ETF 해외주식투자 테마 전략을 정교한 ETF 포트폴리오로 구성하여 누구나 손 쉽게 투자할 수 있도록 만들어진 서비스입니다. 
기존에 제공중인 6개의 테마 포트폴리오 외에도 더 다양한 포트폴리오를 만나실 수 있도록 johy0306님의 소중한 의견은 개발팀에 전달하겠습니다. 추운 겨울 감기 조심하시고 새해 복 많이 받으세요! 힘이 되는 리뷰 감사합니다. 쿼터백 팀 드림. "
꾸준히 투자하기에 좋습니다,"소액으로 장기투자 중인데 밸런스 상품에서 오펜스 상품으로 옮기고 수익률이 20프로 정도입니다
진작에 오펜스로 가입할껄 그랬네요
매월 알아서 진행되는 리밸런싱도 굿입니다
여튼 믿고 맡겨놓으니 수익이 나서 너무 좋네요",5,2021-11-15 07:02:19,"안녕하세요 수익률20프로님, 쿼터백입니다. 쿼터백은 누구나 전문가가 제공하는 양질의 자산관리 서비스를 누릴 수 있도록 믿고 맡기면 알아서 자산을 관리하는 투자일임 수수료를 대폭 낮춘 자산관리 서비스입니다. 또한 다양한 변수에 흔들리는 시장 속, 안정적인 자산 관리를 위해 정기 리밸런싱을 진행하고 있습니다. 아울러 리밸런싱에 참고한 모든 데이터는 공식 블로그와 유튜브를 통해 모두 투명하게 공개하고 있으니 시간이 되시면 둘러봐 주시면 감사하겠습니다. 꾸수익률20프로님께서 쿼터백 자산관리 서비스를 만족하고 사용하시는 모습을 보니 저희도 정말 뿌듯하고 힘이 납니다! 앞으로도 양질의 자산관리 서비스 제공을 위해 전 직원이 최선을 다하겠습니다. 힘이 되는 따뜻한 리뷰 감사드립니다! 쿼터백 팀 드림"
수익률이 좋네요.,"UI가 타사대비 별로인듯 해서 아쉬웠는데,
내용과 수익률은 확실히 차이나게 좋네요. 
투자상품 수익률이 좋으니 불만은 없지만, 
사용자중심으로 UI개선에도 신경써주시면 감사하겠습니다.",5,2021-05-28 19:45:12,"이용해주셔서 감사합니다. 
고객님의 의견을 적극 반영하여 보다 편리한 UI를 제공하도록 노력하겠습니다.
고객님의 편의와 수익을 위해 앞으로도 열심히 노력하겠습니다."
쿼터백 안전추구형으로 진행중입니다,"수익은 그럭저럭 이지만 돈을 조금 넣어서 ㅎ
비트코인 주식 보다 나는 것 같습니다  ㅎ
조금씩 사용해보고 익숙해지면 나중에 한번 제대로 사용해볼 생각입니다",5,2021-12-20 06:42:15,"안녕하세요 정지되었네요ㅜ님, 쿼터백입니다. 쿼터백 서비스를 믿고 선택해 주셔서 감사합니다. 건강한 자산관리에 도움을 드릴 수 있도록 항상 최선을 다하는 쿼터백이 되겠습니다. 추운 겨울 감기 조심하시고 새해 복 많이 받으세요! 힘이 되는 리뷰 감사합니다. 쿼터백 팀 드림."
너무 편하고 좋아요!,투자 초보라서 할줄 몰라 어찌할줄 몰랐는데 쉽게 설명해주니까 이용하기 편한 것 같아요! 바로 등록해봤네요 :) 유용한 어플인 것 같습니다 ㅎㅎ!!,5,2021-09-29 07:04:22,"안녕하세요 양떼장터님, 쿼터백입니다. 투자 초보도 마음 편히 투자할 수 있도록 투자성향에 알맞은 포트폴리오 구성 부터 시장 분석 데이터에 따른 리밸런싱까지 모두 전적으로 도와드리는 모바일 자산관리 서비스 쿼터백을 선택해주셔서 감사드립니다. 앞으로도 만족하며 사용하실 수 있도록 양질의 서비스 제공을 위해 최선을 다하겠습니다, 힘이 되는 따뜻한 리뷰 감사드립니다! :) "
좋아요 기대되요,친구가 알려줘서 깔아봤어요 초보자인데 어플사용도 간편해서 쉬워요 . 주식이나 etf등 쉽게 투자할 수 있어 좋은 것 같아요. 쿼터백 도움받고 부자되야겠어요~,5,2021-09-29 03:36:54,"안녕하세요 나수운이님, 쿼터백입니다. 쿼터백은 초보자도 마음 편히 투자할 수 있도록 인공지능 기술을 활용하여, 자산을 관리하는 서비스입니다. 추천해 주신 친구분에게도 감사하다는 말씀 전해드리고 싶습니다. 앞으로도 양질의 서비스 제공을 위해 최선을 다하겠습니다 힘이 되는 별점 5점 감사드립니다 :)"
주식 입문자에게 추천!,요즘 주식이랑 투자에 대해 관심이 많이 생겨서 이것저것 투자 어플 알아보다가 설치했어요! 주식에 대해 잘 몰라도 알아서 추천해줘서 투자하기 너무 편하네요 어플도 깔끔하고 가독성이 좋아 사용하기 좋습니다,5,2021-09-29 02:31:35,"안녕하세요 1010가나다님, 쿼터백입니다. 쿼터백은 주식에 대해 잘 모르셔도 쿼터백이 빅데이터 분석 및 인공지능 기술을 활용하여 시장을 분석하고, 자산 배분 포트폴리오를 효율적으로 구성하여 자산관리를 도와드리는 서비스입니다, 추천한 지인분께도 정말 감사하다는 인사 전해드리고 싶습니다. 앞으로도 만족하며 사용하실 수 있도록 양질의 서비스 제공을 위해 최선을 다하겠습니다, 힘이 되는 긍정적인 리뷰 감사드립니다!"
주린이에게최고,"저에게 알맞는 상품을 추천해줘서 너무 좋았고 
제가 직접 투자하는것 보다 수익율이 더욱 좋아서 앞으로도 애용할 것 같습니다",5,2021-09-30 06:19:28,"안녕하세요 캉캉맛있쥬님, 쿼터백입니다. 쿼터백은 개인의 투자성향에 알맞은 정교한 포트폴리오를 제공하고, 일임 계약 이후에도 꾸준히 증시를 분석하여 포트폴리오의 재구성(리밸런싱)또한 전적으로 도와드리는 모바일 자산관리 서비스입니다. 앞으로도 캉캉맛있쥬님께서 만족하며 애용하실 수 있도록 양질의 서비스 제공을 위해 최선을 다하겠습니다. 힘이 되는 따뜻한 리뷰 감사드립니다!"
지금같은 시기에 강추입니다!!! 개투보다 나음ㅠㅠ,"개투로 주식 말아먹었는데
제가 직접하는 것 보다 낫네요...
큰 수익은 아니지만 이렇게 차곡차곡 수익 쌓는게 자산관리에 훨씬 도움되는 것 같아요
소액이라도 해보는거 추천",5,2020-05-08 22:50:54,"이용해주셔서 감사합니다. 
고객님의 편의와 수익을 위해 앞으로도 열심히 노력하겠습니다."
주린이에게 딱!,"역시 투자는 어려운 저같은 주린이에게 딱이에요^^
AI가 알아서 해주니까 신경쓸 필요없고 수익률보는 재미도 있고👍👍
가입도 쉽고 UI도 저는 보기편했어요!",5,2021-09-08 03:22:00,"안녕하세요, 꽁베어님! 쿼터백 자산관리 서비스를 믿고 선택해 주셔서 감사드립니다. 

쿼터백 자산관리 서비스는 투자를 잘 모르는 사람도 마음 편히 투자할 수 있도록 데이터에 근거한 객관적인 투자를 도와드리는 서비스입니다. 앞으로도 양질의 서비스 제공을 위해 최선을 다하겠습니다. 따뜻한 응원의 한 마디 감사드립니다."
좋아요,앱구성도 깔끔하고 무엇보다 투자성향을 스스로 진단하고 그에 맞게 투자상품을 추천해줘서 편리하네요. 수익률도 꾸준하고 초보도 가능하다는 점이 좋은것 같아요.,5,2020-10-08 04:35:40,이용해주셔서 감사합니다. 고객님의 편의와 수익을 위해 앞으로도 열심히 노력하겠습니다.
ai가 투자성향에 맞게 알아서 투자해주고 관리해주니 좋네요,"어떻게 보면 사람보다 똑똑해보이네요
안정적으로 수익올리기에 괜찮을것같아요",5,2021-09-03 00:45:13,쿼터백은 빅데이터 및 인공지능 기술을 바탕으로 감정적인 요소에 흔들리지 않는 규칙화 된 투자를 도와드리는 자산관리앱 입니다. 다양한 글로벌 신호를 바탕으로 시장의 국면을 객관적으로 분석한 뒤 고객님의 포트폴리오를 구성하여 안정적인 자산관리를 도와드리고 있습니다. 기대해주신 만큼 만족하실 수 있도록 항상 최선을 다하겠습니다. 응원의 한 마디 감사드립니다!
주린이도 가능,"가입절차가 복잡하지도 않고 사용하기에
매우 간편합니다 투자수익도 기대중 ㅎㅎ̆̈ 
저같은 주린이에게 딱이네여 :)",5,2021-09-29 01:50:39,"안녕하세요 ㅜㅇ어옹엉약양님, 쿼터백입니다! 주린이도 마음 편히 투자할 수 있도록 도와드리는모바일 자산관리 서비스 쿼터백을 선택해 주셔서 감사합니다 쿼터백과 함께 자산관리의 즐거움을 경험해 보세요! 힘이 되는 따뜻한 리뷰 감사드립니다 :)"
처음 성향 파악이 좋네요,투자 초보인데 성향 분석 먼저 하고 상품 추천해줘서 편했습니다. 수익 좀 잘 났으면 좋겠네요 ㅎㅎ,5,2019-05-15 07:06:25,"이용해주셔서 감사합니다. 
고객님의 편의와 수익을 위해 앞으로도 열심히 노력하겠습니다."
주린이,"주린이로
시작하려는데 퀴터백 어플보고 시작하녀고합니다
좋은평이 많아서 기대됩니다^^",5,2021-09-23 02:32:34,"안녕하세요, 달별빛님! 주린이도 마음 편히 투자할 수 있도록 도와주는 자산관리 서비스 쿼터백을 믿고 선택해 주셔서 감사합니다! 달별빛님의 기대에 부흥할 수 있도록 양질의 서비스 제공을 위해 최선을 다하겠습니다. 따뜻한 응원의 한마디 감사드립니다 :)"
편리한 앱,앱 동작도 깔끔하고 무엇보다 상품에 원하는 정보가 한눈에 들어와 좋네요 ㅎㅎ 수익도 기대해 보겠습니다 ㅎ,5,2019-09-04 00:44:27,"이용해주셔서 감사합니다. 
고객님의 편의와 수익을 위해 앞으로도 열심히 노력하겠습니다."
투자 설계 해보기 편해요,카카오 연동으로 쉽게 알아볼 수 있어서 좋은것 같아요,5,2019-09-04 00:18:13,"이용해주셔서 감사합니다. 
고객님의 편의와 수익을 위해 앞으로도 열심히 노력하겠습니다."
로그인이 안되요,"상품 가입햇는데 로그인이 안되고 튕깁니다.. 카카오 설정에 가서 연결 끊고 다시 해봐도 튕기네요. 

저와 같은 사례가 꾀 있을것 같습니다. 해결되었으면 합니다.",2,2020-06-23 10:33:56,"먼저 이용에 불편을 드려죄송합니다.
고객님이 말씀하신 오류는 현재 수정된 상태이며  최신 버전을 다운로드 받아주시기 바랍니다.
추후 이런일이 발생하지 않도록 최대한 품질관리를 위해 노력하는 모습을 보여 드리겠습니다.
앞으로도 많은 의견과 잘못된 부분을 남겨 주시면 빠르게 고객님의 의견을 반영하도록 하겠습니다.
고객님의 편의와 수익을 위해 앞으로도 열심히 노력하겠습니다.
감사합니다."
로그인이 안되요,"오류 해결좀 해주세요. 카카오로 로그인 하기에서 넘어가질 않네요

앱 삭제 다시하고 열번하고 기기껐다 다시하고 다 안되네요 정말 불편해요. 다른 방안 알려주시거나 업데이트좀 해주세요~",2,2020-02-29 00:46:50,먼저 이용에 불편을 드려 죄송합니다. 해당 현상은 카카오톡에서 인증번호 수신받지 못해 발생하는 문제로 판단됩니다. 지속적으로 같은 증상 발생 시 아래 방법으로 진행 해보세요 아이폰 설정 > 일반 > 저장공간> 카카오톡 > 앱 삭제 아이폰 설정 > 일반 > 저장공간 > 쿼터백 > 앱 삭제 카카오톡 앱 재설치 후 로그인 쿼터백 앱 재설치 후 로그인 감사합니다.
상세보기시 강제종료됨,"목표치 설정값이 잘못들어갔는지
수정후부터 상세보기시 어플 강제종료됩니다",4,2020-02-03 09:53:49,"먼저 이용에 불편을 드려 죄송합니다.
오류 사항에 대해서는 앱내 문의하기 기능을 통해 문의를 주시면 보다 빠른 처리가 가능합니다.
앞으로 사용에 불편함이 없도록 노력하겠습니다. 감사합니다."
편리한 자산관리 앱👍,"가입절차가 복잡하지 않아서 좋네요 :)
투자수익도 기대됩니다!",5,2019-05-02 07:26:22,"이용해주셔서 감사합니다. 
고객님의 편의와 수익을 위해 앞으로도 열심히 노력하겠습니다."
매우 편리해요,인터페이스도 간결하고 사용하기에 매우 좋습니다,5,2020-09-01 10:58:36,"이용해주셔서 감사합니다. 고객님의 편의와 수익을 위해 앞으로도 열심히 노력하겠습니다.
"
아주 좋아요,지인에게 추천 받아서 서비스 이용중입니다. 아주 편리하고 좋네요.,5,2021-09-03 09:19:38,"안녕하세요, 욤츄님! 쿼터백 자산관리 서비스를 믿고 선택해 주셔서 감사드립니다. 저희 앱을 추천해 주신 지인분께도 감사하다는 말씀 전해 드리고 싶습니다. 쿼터백 자산관리 서비스와 함께라면 일상에 집중하는 것만으로도 건강하게 자산이 성장하는 행복한 변화를 만나실 수 있도록 항상 최선을 다하겠습니다. "
폰 재설정 뒤 로그인이 안됩니다,아이폰 재설정 뒤 로그인 풀려서 로그인 하려는데 계속 튕기네요. 로그인 방법도 카카오톡 로그인 밖에 없어서 참.. 해결해주세요,3,2020-02-24 16:49:40,"먼저 이용에 불편을 드려 죄송합니다. 
해당 현상은 카카오톡에서 인증번호 수신받지 못해 발생하는 문제로 판단됩니다. 
지속적으로 같은 증상 발생 시 아래 방법으로 진행 해보세요
아이폰 설정 > 일반 > 저장공간> 카카오톡 > 앱 삭제
아이폰 설정 > 일반 > 저장공간 > 쿼터백 > 앱 삭제
카카오톡 앱 재설치 후 로그인 
쿼터백 앱 재설치 후 로그인
감사합니다.
"
드디어 필요한 서비스가 나왔네요,정말 필요한 자산관리 앱인 것 같아요,5,2019-09-21 14:26:41,이용해주셔서 감사합니다. 고객님의 편의와 수익을 위해 앞으로도 열심히 노력하겠습니다.
수익율 좋다고 추천 받았습니다,앞으로도 계속 수익율 기대해 보겠습니다.,5,2019-05-02 08:55:25,"이용해주셔서 감사합니다. 
고객님의 편의와 수익을 위해 앞으로도 열심히 노력하겠습니다."
달러투자 ㅎ,지금같은 달러투자 하기 좋은 시기에 최고의 수단인거 같네요 ㅎ,5,2020-12-06 13:42:53,"이용해주셔서 감사합니다. 
고객님의 편의와 수익을 위해 앞으로도 열심히 노력하겠습니다."
초보투자자,초보라서 자동화 관리에 맡겨봅니다 화이팅,5,2021-09-02 11:33:46,"안녕하세요, 도크도도님 쿼터백의 자동화 자산관리 서비스를 시작하셨군요! 쿼터백은 투자를 모르는 분들도 쉽게 국내 및 해외 ETF 투자를 시작하실 수 있도록 만들어진 인공지능 자산관리 앱입니다. 일상에 집중하는 것만으로도 자산이 건강하게 성장할 수 있는 행복한 변화를 경험하실 수 있도록 앞으로도 최선을 다하겠습니다. 감사합니다 :)"
카카오 로그인에서 안넘어갑니다,다시 삭제하고 또 설정하고 재설치를 해야된다면 너무 귀찮네요... 삭제할께요,1,2020-04-06 04:45:07,"먼저 이용에 불편을 드려 죄송합니다. 
지속적으로 로그인이 안되시면 ""카카오톡> 설정 > 카카오 계정 > 연결된 서비스 관리 > 외부 서비스 > 쿼터백 로보어드바이저 > 연결 끊기 "" 후 쿼터백 앱에서 로그인 바랍니다. 
단, 이 방법으로 로그인 시 신규 계정으로 전환되어 로그인 됩니다. 
일임 계약이 되어 있는 경우 쿼터백 앱 문의하기를 통하여 계정 전환 신청을 해주시면 복구가능합니다."
좋아요!,수익률 보는 재미도 쏠쏠하고 쿼터백 좋네요~,5,2021-09-02 05:24:11,"쿼터백 앱을 이용해주셔서 감사합니다, 앞으로도 즐거운 앱 사용 경험을 위해 열심히 노력하겠습니다. 힘이 되는 리뷰를 남겨주셔서 정말 감사합니다 :)"
워렌버핏슨생님도 말허신 요즘 대세 etf..?⭐️,"여윽시 투자는 전문가에게,,,🌟내가 투자 공부하려하지말고,, 그냥 전문가슨생님께 돈 맡기면 이렇게 맘편한 것을,,,, 끌끌,, 워렌버핏슨생님도 유언에 etf투자하라고 남기셔서 이것저것 찾다가 속는셈치고 최소금액만 투자해봤는데 현재까지는 만족입니다 후후,,💪🏻💪🏻 일단 저같은 주린이가 사용하기에 딱 군더더기 없이 깔끔한 펀드투자 어플이라 강추💪🏻 아 근데 저는 지금 안전추구형 투자성향인데 투자성향을 재설정할 수 있나요?",5,2020-09-09 08:58:49,"이용해주셔서 감사합니다. 고객님의 편의와 수익을 위해 앞으로도 열심히 노력하겠습니다.
투자성향은 앱 실행 후 설정 -> 나의 투자성향 -> 투자성향재측정 을 통해 투자성향을 재측정 하실 수 있습니다."
