reviewId,content,score,at,replyContent
2e24cc08-e7ae-4630-9bda-0456d8fae6d9,"펀드, 주식하는게 나을 것같아요. 가입 후 탈퇴 및 환불절차 시간 많이 소요되고 번거롭기만합니다. 원금보장되는 상품이니에요. 실수로 설치하셨다가 소액이라도 손실 안나시길 바랍니다. 포트폴리오니 리밸런싱이니 겉만 번드러진 용어에 속지마시길... 투자하시려면 얇팍한 어플보다는 공부해서 실전 투자하세요. 수익이 나지 않으면 자문수수료를 안받는다고 명시되어있지만 원금손실은 왜 언급을 안하실까요. 검증안된 AI시스템을 믿고 투자하지마세요",1,2021-07-20 03:13:56,"안녕하세요, So yeong Park 고객님 :) 남겨주신 것처럼 투자 상품 특성상 원금 손실의 위험성이 존재합니다. 이에 대해 앱 정보에 기재되어있으며 더 나아가 광고 또한 원금이 보장되지 않는다는 내용이 서술되고 있습니다. 파운트는 운용 안정성 및 성과 유효성을 검증하기 위해 정부에서 만든 제도 '로보어드바이저 테스트베드' 를 통과한 정식 로보어드바이저 앱 서비스이며, 매매에 소요되는 기간은 각 상품별 존재하는 고유 기간으로 파운트만의 특징은 아닙니다. 증권사 활용으로 인한 불편함은 충분히 공감하며 죄송하게 생각합니다. 다만 고객님의 자산을 안전하게 운용하기 위한 프로세스인 점 참고하여주시면 감사하겠습니다."
ee83ec13-8807-4f4f-b7e1-19f533a2e6ef,최악입니다 절대 돈넣지 마세요. 수익률은 뭣도못내면서 수수료는 떼갈거 다 떼가고 해지하려고하니까 요리조리 숨겨놓고 다른 증권앱에서 수없이 복잡한 절차를 통해 2주뒤에 환급받습니다. 시중어디에도 펀드이딴식으로 환매 어렵게 해놓은 곳 없습니다. 일반은행도 인공지능펀드있으니 그거하세요. 진짜 정신차려봐야됩니다 여기.,1,2021-09-23 21:43:48,"안녕하세요, Stanley Toh 고객님 :) 환매과정에서 불편을 느끼셨군요. 우선 수익이 없는 경우 파운트에서는 보수를 일절 수취하지 않습니다. 투자 프로세스는 안정적으로 투자하실 수 있게 증권사와 제휴를 맺어 증권사 계좌를 활용하고 있습니다. 계약 해지 시 파운트 전용 투자계좌는 증권사 일반 계좌로 전환되어 개인거래 용도로 사용할 수 있는 상태가 되기에 계약해지 후 환매된 자금은 증권사 앱을 통해 다른 계좌로 이체하시거나 개인투자를 이어나가실 수 있습니다. 펀드는 증권사-운용사- 수탁회사-예결원을 거쳐 자금이 관리되고 있어 매매기간이 다소 소요되는 상품 특성이 있는 점 참고하여주세요. 의견을 남겨주셔서 감사합니다."
68032b7a-9746-4c40-b299-3831d5081c45,1년 가까히 파운트에 돈 맡겨놓고 지켜보고 있고요 이번달 초에 리밸런싱 됐는데 80% 이상 미국 주식에 들어갔네요. 어떤 알고리즘으로 투자가 됐는지 모르겠지만 최근 금리인상이슈 경기둔화우려 등으로 경기방어주나 배당주등으로 포트폴리오 변화를 가져가는게 맞다고 생각하는데 기술주 중심에 인덱스 펀드로 리밸런싱 되서 완전 반대로 가네요. 중국펀드는 실컷 손실나더니 이제 슬슬 올라오는 단계에서 다 손절 처리하는건 뭔지 모르겠네요. 파운트 말고 저 스스로 굴려서 얻는 수익을 여기서 다 까먹어서 수익률 0에 수렴하네요. 다음 리밸런싱 4월인데 그때까지만 보겠습니다.,1,2022-01-22 09:28:28,"안녕하세요, 고상원 고객님. 투자중이신 상품이 어떤 알고리즘으로 투자 됐는지 궁금하시다면 저희 파운트 앱에서 1:1 상담하기, 또는 카톡에서 파운트를 검색해주시면 친절히 안내드리도록 하겠습니다. 직접투자도 병행하신다면 파운트 투자에 대해 답답함이 있으실 거라 생각됩니다. 1년 가까이가 아닌 3년이상 장기투자로 진행해 주신다면 안정적인 투자가 될 것이라 믿고 있습니다. 지속적으로 금융시장을 모니터링하면서 고객님의 소중한 자산을 잘 운용하도록 하겠습니다. 늘 건강하시고 좋은 하루 되시길 파운트가 기원하고 있습니다, 감사합니다."
bc30b398-8525-4a3d-83f5-e7e281a6d187,수익률도 계속 마이너스이고 자금형성에 전혀 도움이 안됩니다,1,2022-01-19 15:35:26,"안녕하세요 , 김민형 고객님. 고객님의 소중한 시간 할애 감사 드립니다. 현재 파운트는 많은 고객님들께서 만족하시면서 이용 중이십니다. 외부 증시상황에서도 장기적으로 우상향하는 알고리즘으로 하락장에 방어하며 고개님의 자산을 불려가도록 하겠습니다. 발전하는 파운트가 되도록 하겠습니다, 늘 건강하시고 좋은 하루되세요."
6c2c44f8-2d0b-4cbe-ba4f-090168aaf953,어느덧 가입한지 400일째 -16%수익률이다. 내가 이걸 왜했는지 ㅋㅋ 광고만 하고 제대로 투자는 안하고 진심 쓰레기..로봇어드바이저... 돈버릴사람은 투자하세요.,1,2022-03-20 19:27:45,"안녕하세요, Jong Hyeong Ryu 고객님 :) 수익률에 대해 리뷰를 남겨주셨네요. 만족스러운 성과를 제공해드리지 못해 죄송합니다. 고객님들마다 포트폴리오가 다르다보니 리뷰상에서 상담을 진행해드리기 어려운 점 양해를 구합니다. 보다 상세 상담을 원하시는 경우 카카오톡 고객센터로 연락해주세요."
a651bb64-827b-4bcc-9940-1b049e9c7437,"업데이트 할때마다 로그인을 다시 하라고 하는데, 지문로그인도 풀리고 다 풀려서 정말 짜증납니다. 금융앱 중에 앱 업데이트 했다고 로그인 다 풀려버리는 건 처음 보네요",1,2020-01-17 06:46:23,"안녕하세요, 이재호님. 불편을 드려 죄송합니다. 몇몇 최신 기종들에서 말씀하신 증상들이 보고되고 있어서 원인을 파악했고, 개선을 완료하였습니다. 늘 고객님의 의견에 귀 기울이며 더 나은 서비스를 만들기 위해 노력하고 있습니다.
불편하신 점이 해결되셨다면 별점에 대한 조정도 고려해주시기를 부탁드리겠습니다. 감사합니다!"
36e15234-c7cc-4329-9e7c-1518a912b0f0,"리뷰 잘 안 다는데, 문제 발생한 부분에 대해서 본인들은 어쩔 수 없다 방관하며 일처리하는 부분에 실망하고 어플삭제함 분명히 계속 반복될 에러사항인데도 그저 고객감수로 마무리... 절대 추천하지 않습니다",1,2022-03-27 10:00:03,"안녕하세요,밍밍 고객님. 문제 발생한 부분이 있었음에도 처리 되지 않아 실망하셨음에 진심으로 사과 말씀 드립니다.
앱 사용이다 보니 각 핸드폰의 사양이나 핸드폰의 개별 문제의 경우 문제 처리가 어려울 수 있음을 안내 드립니다.
절대로 파운트는 고객님들이 겪는 문제는 방관하지 않음을 전달드리면서 그럼에도 불구하고 좋지 못한 경험을 하신 부분에 대해서는 정확한 사유 파악에 앞서 사과 말씀 드립니다. 고객님께 정확한 상담을 드리고자 CV팀 1833-4656 또는 카톡 상담으로(월화수목금 9시~6시) 문의주시면 상담 또한 친절히 진행해드리도록 하겠습니다. 코로나가 기승인 요즘 고객님 가정이 평안하시길 기원합니다."
02da9409-179c-4af8-93ef-ada99f3708ff,입금만 하면 알아서 해주니까 편하긴 한데 추가입금해서 리밸런싱한번 하니까 마이너스를 감당을 못하겠음 리밸런싱 전엔 적게나마 수익이 떴는데 리밸런싱 하니까 계속 마이너스만 나옴 그놈의 중국꺼는 왜 사서 -16%를 만드는거야 그리고 리밸런싱을 한다고 해도 기간이 너무 길어서 답답한데 구체적인 진행사항을 알수가 없으니까 답답함 그 자체 적게나마 수익이 계속 뜨면 계속 추가 입금하려고 했는데 마이너스가 너무 아파서 해지도 못하겠음 마이너스가 일정 수치나 일정 기간 계속 되면 알아서 리밸런싱해주면 안되겠습니까 하락장이고 뭐고를 떠나서 이렇게 불안정한것만 사서 -16% 이딴식으로 뜨면 누가 믿고 쓰겠습니까,1,2021-03-31 13:05:37,"안녕하세요, 고객님 :)
글로벌 자산배분은 주로 선진국/신흥국의 주식과 채권을 조합하여 운용하게 됩니다. 경기가 불안할땐 신흥국 자산에 대한 아쉬움이 있을 수 있으나, 회복/성장하는 시기엔 신흥국 자산을 보유하지 않을 경우 반대로 충분한 수익을 만들기 어려울 수 있습니다.
또한, 포트폴리오의 자산들은 중장기에서 우상향이 가능한 자산이기 때문에 손실시점에 매도를 하기보다는 일부 가치가 상승한 자산을 팔아 가치가 떨어진 자산을 추가 매수하게 설정하여 장기성과를 높이게됩니다.
그렇다보니 단기적으로 걱정이 있으신 것에 충분히 공감하지만, 파운트를 믿고 장기투자를 이어가신다면 만족할 수 있는 성과로 믿음에 보답하도록 하겠습니다!"
d61e0910-0352-493e-a4a7-655514630484,자동이체도 안되고 해지하면 수수료만 쏙빼먹고 그때부터 나몰라라 합니다. 돈 꺼내려면 신한알파앱에서 알아서 펀드 정리해야합니다. 비슷한 다른 서비스들 써봤는데 이렇게 불편한 서비스는 처음이예요.,1,2021-06-24 13:22:44,"안녕하세요, Bon-Woong Ku 고객님 :) 출금 시스템에 대해 불편 사항을 남겨주셨네요. 파운트에서도 이러한 불편을 인지하고 있으나 증권사 계좌로 투자가 이루어지는 특성상, 파운트 계약 해지 이후에는 파운트에 관련 권한이 없어 증권사를 통한 매매확인 및 이체업무를 진행해주셔야합니다. 연금은 세금처리 이슈로 직접 매도를 진행해주셔야 하며 나머지 상품은 자동으로 매도 신청이 이루어집니다. 불편을 저희도 통감하고 있기에 카카오톡 고객센터(앱 내 1:1문의하기)로 연락주시면 최대한 쉽고 상세하게 안내드리고 있습니다. 불편드려 죄송하며, 보다 편리한 서비스를 제공하기 위해 힘쓰겠습니다! 의견에 감사드립니다."
72f55812-a675-4b9d-8b98-a16cec1a0cfd,상당히 심각하네요... 수익조차 안나는 상태에 입금은쉽게 출금은 어렵게?? ㅋㅋㅋㅋ 수익이 없으면 수수료는 없다?? 수수료가 없으면 뭐해 이미 다 잃어놓고,1,2020-11-02 16:54:01,"안녕하세요, 박경민 고객님. 마이너스 수익률로 해지를 하시게 되어 정말 아쉽습니다! 파운트 포트폴리오는 꾸준히 가치가 상승해온 자산만을 선별하여 구성하기에 중/장기적으로 우상향하는 그래프를 그리게 설계되었습니다. 물론, 시장에 영향을 받지 않을 수는 없기에 단기적으로는 손실이 발생할 수 있지만 상담(pf.kakao.com/_xcixfWC/chat) 을 통해 단기 손실에 대한 걱정과 고민을 해결해드리고 있습니다! 증권사 계좌를 활용하기에 앱 내 출금이 어려운 상태이나 개선을 진행 중이니, 다시 사용하시게 될 때에는 더 편리하게 사용하실 수 있도록 하겠습니다."
4bb6f2b8-c591-42a1-8e96-ce1567f742d7,앱 실행할때마다 지문도 안되고 비번도 안되고 로그인 자체가 안됩니다. 제거 후 다시 설치하고 다시 인증해야 하는데 매번 할때마다 이러니 뭔가요 이게,1,2020-02-22 09:38:08,"안녕하세요, 김세오 님. 사용에 불편을 드려 죄송합니다. 
기존 앱데이터로 인해 해당 증상이 발생하는데, 아래 조치로 해결 가능합니다. 

설정- 애플리케이션- 파운트 선택- 저장공간- 데이터 삭제 
조치 후 앱에서 본인인증 진행하시면 지문/비밀번호로 로그인 가능합니다. 

조치 후에도 문제가 발생할 경우, 고객센터(1833-4656)나 카카오채널(http://pf.kakao.com/_xcixfWC/chat)로 알려주시면 신속하게 처리해드리겠습니다. 불편을 드려 다시 한 번 사과드리며, 이후에는 원활한 업데이트가 될 수 있도록 만전을 기하겠습니다. 
해결되었다면 잘하라는 의미로 별점 조정도 조심스럽게 부탁드리겠습니다."
230f3c15-b246-41e7-8afc-fbca9a1e7730,마이너스만 주구장창 찍다가 결국 손해보고 나왔습니다 ㅠㅠ 공격형 투자라서 그럴 수도 있지만 이익은 정말 잠시만 보고 계속 마이너스만 찍으니 너무 속상하네요,1,2021-06-07 09:59:49,"안녕하세요, 정서현 고객님 :) 같은 투자자의 입장에서 원하는 성과를 달성하지 못한 것에 대한 아쉬움과 속상하실 마음에 크게 공감합니다. 다만 공격형 상품은 2~3년 이상의 투자기간을 권장하는 만큼 변동성이 큰 포트폴리오로 차후 재투자를 진행하게 되실 땐 권장기간을 최대한 확보하여주시고 주기적인 리밸런싱을 진행해주시길 바랍니다. 궁금한 사항이 생기면 언제든 카카오톡으로 연락해주세요."
c555ca63-b1bc-46a5-9576-9017ff0c1a71,일단 100만원만 넣고 시작한지 반년조금 넘었는데 한번도 수익난적은 없고 꾸준히 조금씩 마이너스로 깎이기만 하는중 손해본상태에서 리벨런싱 해야한다며 매도 강요당해 계속 손해만 발생중..,1,2020-08-14 11:11:52,"안녕하세요, 티비탁 고객님 :)
저희 파운트 서비스 글로벌자산배분 투자로 최소 1년 이상의 투자기간을 기준으로 목표한 수익률에 도달할 수 있게 포트폴리오를 구성하고 있습니다. 

리밸런싱 때 또한 전액 매도/전액 매수가 아닌 일부 자산의 변동만 있기 때문에 말씀하시는 것과 같은 수수료 손해는 발생할 가능성이 매우 낮습니다.

조금 더 자세히 이야기를 들어보신다면 저희와 함께 장기투자로 좋은 성과를 내가는데 도움이 될 것 같아 15분 상담을 추천드립니다.

아래 링크로 연락을 주시면 편한 시간에 상담을 진행하실 수 있도록 도와드리겠습니다.
https://fount.pub/talk 감사합니다!"
db66a8ac-6d65-4668-aca0-5b8f648f4303,"어제 3개월차 투자운용보고서 받았는데.. -18프로 실화입니까? 어이없어서.. 소액으로 할 수 있다는거 이외에 장점 1도 모르겠음.. 첫달부터 마이너스기는 했지만., 참고 기다렸는데.. 이건 뭐 갈수록 더 떨어지네요. 원금 회복되면 바로 해지할 예정입니다. 진짜 짜증나네요",1,2021-05-02 08:08:13,"안녕하세요, 달콤달콤 고객님 :) 3개월 이상 펀드 투자 고객 중 -5% 이하의 수익률을 보이는 고객은 존재하지 않기 때문에 파운트의 상품이 아니거나, 보유 중인 개별 펀드의 수익률을 오해한 것이 아닐까 생각됩니다. 포트폴리오 내 개별 종목이 각기 다른 상승 시점을 가지기 때문에 단기적으로는 특정 펀드는 수익이 나지만, 또 다른 펀드는 손실이 발생할 수 있습니다. 1년 이상 포트폴리오를 유지한 고객 중 손실 고객이 없을 만큼 우상향을 할 가능성이 높은 자산들로 이루어져있어 투자기간을 확보해주신다면 충분한 수익을 낼 것으로 예상됩니다. 더 자세한 투자상담이 필요하시다면 앱 내 1:1 상담하기를 통해 질문 부탁드리겠습니다!"
69179009-33a6-4544-85a2-c3a32be85f41,소액넣어놓고 2달동안 본전치기하고 이건 제가 짧게 넣어놓은거니 그렇다치는데 무슨 수수료를 얼마를 때는건지 광고는 수익없으면 수수료 없다광고하고 어쨌든 2달동안 일을 했으니 그에대한 금액을 때가는건 수수료 아닌가 어이가없네 상품에는 최대 수익률로만 계산해주고 혹하게만들기만하고 댓글 알바를 쓰는건지 이해가 안가네요 진짜,1,2021-04-03 12:51:11,"안녕하세요, 이종민 고객님 :) 환매대금 또는 아직 환매가 완료되지 않은 종목으로 인한 오해가 있어보입니다. 수익이 없는 경우 파운트에서는 수수료를 수취하지 않습니다. 환매대금은 매도기간을 거쳐 출금이 가능한 상태가 되는 금액인 점과 파운트에서 제공해드리는 투자상품은 일반 주식과 다르게 매매기간이 다소 소요되는 투자상품 인 점 이용에 참고해주세요!(펀드:9영업일, ETF:4~5영업일) 종목마다 소요기간이 다르며 해당 기간 이후 출금가능한 상태로 전환됩니다. 이해되지 않는 부분이나 궁금한 사항은 카카오톡(http://pf.kakao.com/_xcixfWC/chat)으로 연락주시면 보다 상세하게 답변드리도록 하겠습니다."
544dc424-47e9-4962-8af2-ee11f4a5b404,"5% 상승장에는 1% 상승하다가, 하락장 되자마자 그대로 반영해서 주식,채권 상품 모두 수익률 떨어지네요. 시장 상승세는 못 따라가면서 작년 중국 리스크, 올해 시장 하락세는 발생하자마자 수익률 고꾸라지는게 주유소 기름값으로 장난치는 정유사 보는 것 같네요. 목표 수익률이 6%인데 투자 중 2~3% 수익률도 본 적이 없으면 대체 뭘 믿어야 할까요?",1,2022-01-26 16:39:32,"안녕하세요. SH K님, 고객님의 소중한 시간 할애 감사드리면서 파운트의 직원이자 같은 투자자로서 고객님의 불안한 마음을 깊이 이해합니다.팬데믹시기에도 파운트는 고객님의 자산을 최대한 방어하면서, 파운트의 알고리즘 엔진은 세계 각국의 경제 데이터 및 다양한 시장 지표 등 449개의 지표를 조합하여 52,394개의 시나리오를 분석하고 , 이를 바탕으로 글로벌 경기를 예측하는 마켓 스코어를 산출합니다.이를 토대로 고객님의 성공적인 자산관리를 진행하고 있습니다. 누구나 손실을 경험하는 하락장에서 파운트는 고객님의 소중한 자산을 방어할 수 있도록 노력하겠습니다. 늘 건강하시고 좋은 하루 보내시길 기원합니다.감사합니다.
"
9687932f-c951-4707-9739-beac2be2b098,누가봐도 중국펀드는 답이 아닌걸 아는데 ai는 중국을 왜이리 좋아합니까? 덕분에 4달째 마이너스네요. 선택옵션에 특정국가etf 투자못하게하는 기능 추가가 절실합니다.,1,2021-05-07 18:00:54,"안녕하세요, jongku LEE 고객님 :) 우선 현재 수익률에 좋지 않은 영향을 미치는 중국펀드에 대해 걱정이 있으신 것에 대해 충분히 공감합니다. 실제로 중국과 관련된 자산이 아직 손실을 유지하다보니 전체적으로는 마이너스를 기록하고 있으나 중국과 관련된 자산들은 상승시점에 오름폭이 타 자산에 비해 훨씬 높기 때문에 일정 기간을 가지고 기다리시면 포트폴리오는 다시 좋은 성과를 향해 갈 것입니다. 특정구간에서 일반적인 지수투자보다 성과가 낮은 것처럼 보일 수 있으나 기본적으로 우상향하면서 상승시점이 다른 자산들로 구성이 되어 있기때문에 중장기 투자로 갈수록 그 성과가 빛을 발할 수 있을것입니다."
a36145fe-e891-4d00-a991-1dbcf24922f4,잠깐 이용을 안하고 있었는데 업데이트하라고 문자가 날라와서 할려고 들어가니까 지문인식잠금해제가 안되고 간편암호잠금해제도 안됩니다 그래서 플레이스토어서 업데이트를 하고 실행해봐도 같은 증상으로 잠듬해체를 못해 앱에 들어갈수 조차 없습니다 빨리 문제 해결해 주세요,1,2020-02-21 08:41:41,"안녕하세요, 김건우 님. 사용에 불편을 드려 정말 죄송합니다!

기존 앱데이터로 인해 해당 증상이 발생하는데, 아래 조치로 해결 가능합니다.
설정- 애플리케이션- 파운트 선택- 저장공간- 데이터 삭제 조치 후 앱에서 본인인증 진행하시면 지문/비밀번호로 로그인 가능합니다.

조치 후에도 문제가 발생할 경우, 고객센터(1833-4656)나 카카오채널(http://pf.kakao.com/_xcixfWC/chat)로 알려주시면 신속하게 처리해드리겠습니다. 불편을 드려 다시 한 번 사과드리며, 이후에는 원활한 업데이트가 될 수 있도록 만전을 기하겠습니다.

해결되었다면 잘하라는 의미로 별점 조정도 조심스럽게 부탁드리겠습니다."
0f883a23-271a-4425-a4b7-4fd2c5f4787e,본인들이 질의 할수 있는 문진을 만들어놓고 질의를 하였으나 답은 없음 모하러 만들었는지 보여주기 식인가 금액을 추가하여 매매신청하면 기존것까지 모두 매매하여 수수료가 발생하는듯함,1,2021-11-07 21:16:47,"안녕하세요, 함재수 고객님 :) 1:1 문의하기를 통해 문의를 남겨주셨나요? 챗봇에 문의를 남겨주신 경우에는 상담원이 문의 내용을 확인할 수 없으니 '상담원 연결하기' 버튼을 누른 후 문의를 남겨주신 것이 맞는지 확인해주시길 바랍니다. 상품마다 투자방식이 다르긴 하나 펀드는 매매수수료가 없는 종목으로 기본 구성되고 있으며 리밸런싱은 현재 고객님의 포트폴리오와 최적의 포트폴리오를 비교하여 매도 및 매수를 진행하기 때문에 시장상황에 따라 매수만 진행할 수도 매도 후 매수를 진행할 수도 있는 점 이용에 참고하여주세요! 그 외 문의사항이 있다면 '상담원 연결하기' 버튼을 꼭 누른 후 말씀을 남겨주시길 바랍니다."
44915215-3a47-4f02-8c8b-942a610bd436,"광고보고 혹해서 설치했는데 이앱 설치한이후 유독 대출.보험관련 스팸전화가 많이옴 입금은 1분도 안걸리는데 해지, 출금은 번거롭게 해당은행 어플 받아서 내가 알아서 진행해야함 완전 비추",1,2021-04-04 18:08:01,"안녕하세요, Hyunah Song 고객님 :) 스팸전화와 번거로운 출금으로 인해 불편을 겪으셨군요. 다만 파운트에서는 증권사, 한국예탁결제원, 코스콤 등 거래에 필요한 기관과 금융감독원, 금융투자협회와 같은 감독기관외에는 고객분들의 정보를 외부로 전달하거나 마케팅 제휴는 전혀 진행하고 있지 않습니다. 저희 서비스와 비슷한 시기에 가입한 타 서비스 등으로 인해 발생하는 이슈로 판단됩니다. 또 출금의 경우 고객님의 불편사항을 내부적으로도 통감하고 있어 7~8월에는 오픈뱅킹을 활용하여 파운트 앱 자체 출금이 가능하도록 개편될 예정이오니 이용에 참고해주세요!"
a93270bd-bd83-47f7-91c4-41273b193e0a,가입하는 과정에서 휴대폰 인증이 안되고 아무런 반응이 없어서 아무것도 못하는중. 관리자가 일을 안하는듯. 삼일째 시도하는건데 안됨.,1,2021-01-12 11:37:21,"안녕하세요, 양반의사님 :)
가입과정에서 휴대폰 인증문자를 못받으시는 문제가 있으신가요? 인증문자의 경우 개인정보 불일치, 법인폰 사용 등 개인적인 상황과 연결된 문제인지라 앱 리뷰를 통해 직접 해결이 어렵습니다.
카카오톡(http://pf.kakao.com/_xcixfWC/chat)으로 연락주시면 정확한 상황 확인 후 도움을 드리겠습니다 :)"
31e9e224-41ba-4e3b-944b-c389b7aa6764,보안폴더 및 듀얼앱 등이 감지되었다면서 계속 튕기네요. 고객센터에 문의해도 제대로 조치도 안해주고..,1,2021-02-16 09:34:38,"안녕하세요, Minsik Seo 고객님:) 일전에 카카오톡으로 문의주셔서 보안폴더, 듀얼 앱등이 설치되어있으면 삭제후 다시 시도해달라 안내드린 이후 고객님의 응답이 없던 것으로 보입니다. 해당 조치를 취해보셨음에도 동일한 증상이 나타날 경우 원격지원 등을 통해 도움 드릴 수 있도록 하겠습니다! 원격지원이 필요한 경우 카카오톡(http://pf.kakao.com/_xcixfWC/chat)으로 요청 주시기 바랍니다."
c8f9b651-8bb0-49ff-81fc-2cf57a2561b2,로그인에 계속 오류가 발생합니다.ㅠㅠㅠ 모든정보가 제 정보가 맞는데ㅜㅜ 계속 마지막에 확인누를때마다 오류가 발생했다고 하네요ㅠㅠ,1,2020-11-20 09:59:48,"안녕하세요, 황보민제 고객님 :) 로그인 과정에 불편을 드려 정말 죄송합니다!! 신규고객분들이 증가하여 서버를 증설하는 과정 중 오늘(11월 20일) 오전 약 15분간 로그인이 안되는 현상이 생겼습니다. 이는 바로 해결이 되어 현재 정상적으로 로그인이 가능합니다. 혹시 다른 문의사항이 있으시다면 언제든 카카오톡(https://fount.pub/talk)으로 남겨주시면 빠르게 도움드리겠습니다. 감사합니다."
