reviewId,content,score,at,replyContent
01cb001d-afa1-40a7-b03f-38149a026658,몇달 사용했지만 수익은 없고 원금만 까먹네요 광고보고 했는데 후회가 되네요 시장상황은 별반차이가 없는거 같은데...,1,2021-05-11 11:10:35,"안녕하세요, 동왕진리 고객님 :) 먼저 수익률에 대한 아쉬움을 느끼시는 마음에 충분히 공감하며 죄송하게 생각합니다. 다만 파운트에서 제공해드리는 포트폴리오는 중장기 성과를 높히는 것에 가장 특화된 포트폴리오로 단기에 특정한 요인으로 수익을 내는 것이 아니라, 다양한 요인으로 인해 변화하는 시장 사이클이 반복될수록 포트폴리오의 성과가 좋아질 수 있게 구성되어 있습니다. 상품별로 권장되는 투자운용기간에 따라 그에 맞는 변동성을 가지고 성과를 추구해 나가도록 운용하고 있으니 최소 1년 이상의 투자를 이어나가주시길 바랍니다. 걱정되는 사안에 대해 앱 내 1:1 문의하기로 연락주시면 더 상세히 답변드리도록 하겠습니다."
68b1afcf-d727-4883-9ebd-7c520d1495e0,업데이트 이후 마이투자 화면서 넘어가질않습니다 수익도 거의없고,1,2019-04-25 07:25:05,고객님 불편을 드려 죄송합니다. 불편을 드린 사항은 카카오톡 상담하기 http://pf.kakao.com/_xcixfWC/chat 를 통해 문의주시면 빠르게 해결하도록 하겠습니다. 향후 추가 업데이트때 말씀하신 부분 개선하도록 하겠습니다. 최선을 다하는 파운트가 되겠습니다.
d37ec860-7c84-4473-918f-7d6c63df3999,"투자할때는 친절히 알아서 리밸런싱해주더니, 해지할때는 별도의 앱 깔아서 알아서출금하든가말던가 하네요ㅋㅋㅋ",1,2021-02-25 18:26:22,"안녕하세요, 김영봉 고객님 :)
해지 후 출금에 대한 불편함이 있으시군요! 현재 투자자금의 안정적인 보관을 위해 증권사계좌를 통해 운용하기 때문에 해당 증권사 앱을 설치 후 인출을 해주셔야 하는 상황입니다. 다만, 불편함을 인지하고 개선하기 위해 준비 중에 있으며, 올해 하반기에는 앱에서 입출금을 하실 수 있게 업데이트 예정입니다.
그 전까지 불편함을 최대한 줄일 수 있게 카카오톡(pf.kakao.com/_xcixfWC/chat) 고객센터에서 출금안내를 도와드리고 있으니 언제든 연락해주세요!
불편함을 느끼는 부분에 대해 어떤 방법으로든 해결을 하고자하니, 카카오톡으로 연락을 주시면 성심성의껏 문제해결을 돕겠습니다 :)"
8ffc446d-e01a-4d87-9342-6723522ae0e0,연금저축을 했는데 해지하고 보니까 신한알파앱에서 따로 환매를 하고 해지를 해야한다고 하더라구요? 그래서 다 환매하고 열흘넘게 기다려서 환매됐더니 출금하려고 보니 중도 해지하면 16.몇%가 떼인다고 하더라구요 어이가 없어서...파운트를 이용하다가 해지한건데 신한알파앱까지 사용하며 알아보고 문의하고 해지한건데 결국 연금수령일까지 기다리지않으면 돈 다떼이게 생겼어요 절대 하지마세요,1,2021-05-28 09:43:35,"안녕하세요, 윤수정 고객님 :)
연금저축에 대한 오해가 있으신 것 같습니다. 중도해지시 발생하는 16.5%의 환수금은 파운트가 수취하는 것이 아닙니다.
납입한 금액에 대해 국세청으로부터 세액공제 혜택을 받으신 부분을 돌려내는 것입니다.

즉, 연금을 만기일까지 유지하겠다는 약속하에 국세청으로부터 받은 세금 혜택이 있었으나, 이를 유지하지 않으셨기 때문에 국세청에서 세금혜택을 다시 회수하는 것입니다.

만일 작년에 공제 받으신 세금이 없다면 환수되는 세금도 없이 바로 인출이 가능합니다 :)
이는 국내 개인연금저축의 특징으로 파운트에는 중도해지에 대한 수수료가 없는 점 이용에 참고 부탁 드립니다 :)"
52b0485c-cbc2-42c8-92e1-ba028f106059,"수수료 15프로는 선넘었지. 그냥 etf도 높아도 3프로 미만인데 이건.. 주린이 여러분 주식 잘 모르겠으면 차라리 s&p500추종 etf를 하세요. 미국에 상장된 우량주 위주로 된 펀드니까. 수수료 훨씬 싸고요, 자동 리벨런싱 됩니다. 잘 모르겠으면 차라리 바로 투자 하지 마시고, 경제관련 베스트셀러라도 먼저 읽고 판단하세요. 그게 훨씬 현명합니다. 투자는 본인 선택이지만, 공부없이 하는 투자는 호구입니다. 항상 수수료 염두하고 주의하세요. 너무 높은 수수료가 꼭 안정적 자산보장을 해주는 것은 아닙니다.",1,2021-09-15 02:16:01,"안녕하세요, 고객님 :) 파운트의 수수료는 일반적인 비대면 증권계좌의 거래수수료와 다르게 포트폴리오를 추천, 관리하는 것에 대한 자문수수료를 받고 있습니다. 수익이 발생한다면 수익금액 중 15%에 해당하는 금액을 수취하고 있으며, 수수료를 낮출수록 경쟁력은 높아질 수 있겠으나 안정적인 수익을 만들어갈 수 있는 알고리즘을 유지하기 위한 부분도 수수료에 포함되어 있음을 양해해 주시면 감사하겠습니다. 대신 더 좋은 운용전략과 서비스를 만들어가기 위해 노력하겠습니다. 글로벌ETF는 자동으로 리밸런싱이 이루어지는 점 또한 상품 선택에 참고가 되시길 바랍니다.다른 문의사항과 개선 요청 사항이 있다면 카카오톡으로 연락해주세요!"
e18b5dc2-ec45-4bcc-9a67-aab1a2df71bd,수익조금씩벌리다가 계속원금유지하고 수익벌린거 계속 까이길래 해지하니까 원금보다 적은금액으로 돌려주네요 ㅋㅋㅋ 어이가없네요,1,2020-11-20 11:19:19,"안녕하세요, 찐빵이 고객님 :) 먼저 파운트를 사용해주셔서 감사드립니다! 말씀하신 내용을 보아 오해하실만한 부분이 있어서 간략히 설명드리겠습니다. 파운트 해지 시 확인하시게 되는 환매대금에는 유동성자산이 포함되어 있지 않아 원금보다 적은 금액을 돌려 받으시는 것으로 오해하실 수 있을 것 같습니다. 일부자산은 유동성 (현금)으로 이미 보유를 하고 있었기 때문에 환매가 필요하지 않기 때문인데요. 앱리뷰에서는 정확한 정보 확인이 어려운 관계로 카카오톡(https://fount.pub/talk)으로 남겨주시면 실제 수익과 수수료 그리고 인출가능 금액을 상세히 공유드리겠습니다 :) 감사합니다."
0ad43549-5d4f-4d2c-8f65-7de1dee94429,아니 신분증 인식이 왜자꾸 안되냐구요 카메라로 찍어도 안되고 찍은거 업로드해도 안되고 걍 계좌개설자체가 안되는데 내가 뭔 외노자도 아니고 신용도가 낮은것도 아니고 진짜 열받네,1,2019-09-15 13:32:55,"안녕하세요, 배동준님. 불편을 드려 죄송합니다. 해당기간동안 경찰청의 운전면허증 인증 서버에 문제가 있었던 것으로 확인되었습니다. 저희 서비스 뿐만 아니라 운전면허증으로 인증하는 모든 서비스에서 장애가 있었던 상황으로, 너그러이 양해 부탁드리겠습니다. 현재는 문제없이 인증이 되고 있습니다. 
불편하신 점이 해결되셨다면 별점에 대한 조정도 고려해주시기를 부탁드리겠습니다. 감사합니다!"
c8bdc3cc-d3b0-4f91-8eb4-9aafab527ee0,가입은 쉬우나 탈퇴는 지들이 허락해야 되는 어플..어처구니 없는 없는 어플 빨리 탈퇴시키라고요... 별은 마이너스 없는게 아쉽네요..,1,2020-10-19 11:07:51,"안녕하세요, 이용만 고객님:) 앱 사용에 불편을 드려 죄송합니다. 계약이 있는 상태에서 탈퇴를 진행할 경우 이슈나 오류가 발생될 우려가 있어 현재 앱상에 구현해놓지 않고 요청을 주시면 확인 후 처리를 진행해드리고 있습니다. 너그러운 양해를 부탁드립니다. 카카오톡을 통해 이미 탈퇴처리를 진행해주신 것으로 확인 되는데요, 다른 문의 사항이 있으시다면 카카오톡 (http://pf.kakao.com/_xcixfWC/chat) 으로 연락주세요!"
7767dabe-14fd-49c9-8a82-97b5709a1fa4,전화번호인증이안됨니다...자꾸정보가올바르지않습니다...라고나옴니다...,1,2020-11-04 14:32:30,"안녕하세요, 김봉길님 :) 이용에 불편을 드려 죄송합니다. 본인명의의 휴대폰 정보를 맞게 입력하셨음에도 정보가 올바르지 않다고 뜨시나요? 자세한 확인 및 안내를 드릴 수 있도록 해당화면을 캡쳐하여 카카오톡( https://fount.pub/talk)으로 보내주시면 최대한 빠르게 답변 드리도록 하겠습니다!"
8bb7ea63-25f1-4497-83d7-92859a9e3261,별로에요. 수익률도 넘 안좋고 ai가 넘 못굴리는듯,1,2021-02-27 07:13:29,"안녕하세요, Noob Nep 고객님 :)
최근 시장 변동으로 인해 아쉬움을 드려 죄송합니다.
일주일 간 기존 저금리 환경에서 급작스럽게 국채가격이 올라 불안함이 증폭된 것이 하락의 이유였으나, 자세히 들여다보면 금리가 오른 이유는 경기회복에 대한 기대감이었고, 이것이 단기적으로는 금리상승에 대한 압박으로 이어져 악영향을 끼칠 수 있지만 장기적으로는 경기회복은 결국 기업의 성과를 개선시키는 요소가 될 수 있기 때문에 충분히 회복으로 이어질 수 있다고 생각할 수 있습니다.

파운트는 중장기에 안정적인 성과를 만드는 것에 강점이 있는 만큼 잠시 불안하실지라도 파운트를 믿어주신다면 좋은 성과로 보답 하겠습니다! 감사합니다 :)"
97748a85-31e5-4090-8a02-2b6c8da10d4d,해지하고나면 뭘넣었는지 수익이얼만지 내정보는 알수가없음 가입은 쉬으나 그담은 비밀... 빨리 내돈 도~~~~~~~.,1,2021-04-20 23:18:04,"안녕하세요, Sang Do Hwang 고객님 :) 고객님의 안정적인 자산관리를 위해 파운트 서비스는 신한금융투자와 KB증권과 제휴를 맺어 해당 증권사의 계좌를 활용하고 있습니다. (펀드/국내ETF/연금/CMA:신한금융투자, 글로벌ETF: KB증권) 해지하실 때 어떤 종목들에 대한 환매가 이루어지는지 환매가 어느정도의 기간이 소요되는지 제시해드리고 있으며 계약해지가 완료된 이후에는 제휴계좌가 아닌 일반계좌로 전환됩니다. 증권사 앱을 통해 종목별 환급일정 및 체결가 확인이 가능한 점 이용에 참고해주세요. 보다 자세한 설명이 필요하실 경우 파운트 앱 내 1:1문의하기를 이용해주시길 바랍니다."
3ca2098a-1bc9-4a84-9d30-a356c6c61020,충돌도 많이나고 탈퇴버튼을 찾을수가 없음,1,2020-01-26 14:20:17,"안녕하세요, 나나스쿨님. 불편을 드려 죄송합니다.
상품해지버튼은 가입하신 상품의 상세정보에서 찾으실 수 있습니다. 그 외 구체적인 오류 내용에 대해서 고객센터(1833-4656)나 파운트 카카오채널(http://pf.kakao.com/_xcixfWC/chat)로 문의 주시면 최대한 신속하게 조치해드리도록 하겠습니다."
686c267a-7ac7-44b8-b2f0-be55bc561603,직접사용자입니다. 정말 돈뜯어가는어플이네요. 결론적으론 마이너스만 났고 돈버리고 어플삭제하기전에 다른분들피해보지마시라고 적어둡니다. 이런어플유투브광고에속아서한 제가바보같네요,1,2021-03-10 09:23:32,"안녕하세요, 김시헌 고객님 :)
고객서비스를 담당하면서 한번도 고객에게 진심이 아닌 적이 없었던만큼 파운트에 속았다는 기분을 느끼신 부분에서 죄송함을 크게 느낍니다.

파운트는 단기성과를 보장할 수 있는 서비스는 아닙니다. 다만, 장기 성과에서는 충분히 안정적인 모습을 보일 수 있습니다. 장기 우상향 할 확률이 높은 자산을 찾는 것이 파운트의 강점인만큼 단기적으로는 하락이 가능하지만 시간이 충분하다면 안정적인 성과를 만들 수 있기 때문입니다.

답글로는 충분한 답변을 드리기 어려운만큼 파운트 10분 상담 (https://fount.pub/10min) 을 신청해주시면 유선으로 자세한 설명을 드리도록 하겠습니다. 감사합니다"
ca709f08-0087-4bdd-a580-6b112ef660a2,아니 신분증인식 어떻게 하라는건가요??? 인식을 똑바로 되도록 만들어놓던가 사진이 동일하지 않다고 하거나 신분증인식을 못하면 어쩌라는건가요???? 정확한 방법을 기재해주세요 되도않는 방법 말고,1,2021-08-25 11:37:27,"안녕하세요, 멘보샤 고객님 :) 신분증 인증 중 불편을 겪고 계시는군요. 신분증 촬영 인증의 경우 행정안정부와 증권사에서 운영하는 시스템으로, 성함을 개명하셨거나 신분증 상태가 양호하지 않거나 훼손, 빛 반사 등으로 인해 진위여부 확인이 불가한 경우가 있습니다. 성함을 개명하신 경우에는 개명 증빙서류 지참하여 증권사 지점 방문 후 등록된 정보를 변경해주시고 그 외의 경우에는 휴대폰 재 부팅 후 카메라 렌즈를 깨끗하게 닦고 어두운 배경에서 빛이 반사되지 않도록 휴대폰을 가로로 놓고 촬영하셔서 시도해주시면 원활하게 인증이 가능하실 거에요. 직접적인 도움을 드리지 못 해 죄송합니다. 원활한 인증 되시길 바랍니다."
d51c2c1c-d314-4bbf-a7bf-3c6549650eb3,10만원이었는데 9만원이네요. 대박이네요. 이렇게 전국적으로 가입자 모집하면 부자되실거같아요.,1,2021-03-07 14:39:36,"안녕하세요, Tipsy Rabbits :) 고객님 :)
파운트는 고객의 성과가 없으면 절대 수수료를 수취하지 않는 수수료 구조를 가지고 있습니다. 그렇기에 다른 어떤 서비스보다 고객에게 좋은 성과를 만들어 드리는 것이 중요하다고 할 수 있습니다. 물론, 단기적으로는 시장에 영향을 받기 때문에 언제나 +수익을 만들 수 있다고 이야기 드릴 수는 없지만, 1년 이상의 중장기 성과에서는 모든 고객이 수익을 가져갈 만큼 안정적인 성과를 유지하고 있으니, 조금만 더 파운트를 믿고 투자를 이어가 주시면 장기에서는 충분히 만족할만한 성과를 만들 수 있게 노력하겠습니다!"
562a0ce6-e60a-49ff-a438-48f58e7665b5,신분증 찍은게 계속 인식실패가 나와 짜증나서 지웠습니다 괜히 개인정보 노출된거 아닐런지,1,2021-04-08 22:42:48,"안녕하세요, 김현석 고객님 :)
신분증 인식에 불편을 드려 죄송합니다.

인식 실패의 경우 행정안전부 모듈을 통해 진행하고 있다보니 저희가 조정할 수 있는 부분이 없기에 타 신분증 이용 혹은 빛이 반사되지 않는 곳에서의 재촬영을 권장드리고 있습니다.
신분증 인식은 행정안전부에서 처리를 하고 있는만큼 개인정보 노출과는 전혀 무관하니 걱정하지 않으셔도 됩니다."
1be96f20-3917-49df-a99a-51ed04492316,37일째 이용중인데 손해만 30만원 났어요 수익률-5%단한번도 플러스인적이 없었어요 연금도 그렇고요 해지할까 생각중입니다,1,2021-03-26 15:11:43,"안녕하세요, 정혜경 고객님 :)
파운트는 글로벌 자산배분 전략으로 운용하는만큼 단기적으로는 시장상황에 의해 손실이 발생할 수 있지만, 1년 이상의 장기성과에서 안정성을 발휘하는 서비스 입니다.
그렇기 때문에 모든 상품의 권장기간이 1년 이상으로 되어 있습니다. 단기적인 성과를 추구하신다면 리스크가 있을 수 있지만 장기성과를 목표로 하신다면 실제로 1년 이상 투자고객 모두가 수익을 내고있는만큼 안정적인 성과를 얻으실 수 있을 것 입니다 :)"
cf5edb0b-dc41-4fff-9e7f-c70ada928f36,펀드 시작하자마자 수익률 마이너스네요ㅜㅜ 저만 특이한경우인건가요 수익률이 좋으면 추가납입하려고 소액했는데 그냥 해지하고싶어요 수익나신분들은 저랑 시작일이 달라서일까요 :::::추가 후기단지 한달보름넘었는데 하루하루 마이너스더니 이젠 마이너스 5프로가 넘어가네요.. 리밸런싱되면 수익으로바뀔수잇나요 돈은더 넣고싶지않아요 원금만이라도 회복하고싶어요,1,2021-03-26 18:37:52,"안녕하세요, H M 고객님 :) 펀드를 시작하자마자 마이너스 수익이 나서 당황하셨겠네요.
먼저, 걱정하시는 것과 달리 파운트 상품은 1년 이상 투자를 운용하신 분들 기준으로 단 한분도 손실이 발생하지 않을 정도로 중/장기에서 안정적인 성과를 만들어 낼 수 있습니다!
다만, 투자상품이다보니 단기적으로는 등락이 발생할 수 있습니다. 투자로 인한 손실금액에 대한 걱정과 불안을 이해하지만 원금회복을 위해서는 충분한 투자기간을 확보해주셔야하는 점 이용에 참고하여주세요. 투자상담(https://m.booking.naver.com/booking/13/bizes/381139)을 예약해주시면 보다 상세하게 설명드리도록 하겠습니다."
3fe308fd-ec17-48a4-861c-1f55f6dff772,분명5만원 수익이라돼있어서 팔았는데 왜 마이너스로 계좌에 입금됐죠? 어이가 없는 앱이네요 몇달간 돈넣어놓고 마이너스라니..최악이네요.두번다시 안씁니다. 현금화하는데도 열흘은 걸리고 결국 마이너스네요. 안전한 투자성향으로했는데도..완전 비추,1,2021-12-09 11:55:23,"안녕하세요, sky cloud 고객님 :) 최근 투자 계약 해지를 진행해주셨군요. 모든 투자상품은 일정기간을 거쳐 투자자산에서 예수금으로 전환되는 형태로 이루어져 있습니다. 펀드와 연금은 최대 9영업일(연금은 별도 환매 신청 필요), ETF는 최대 3~5영업일에 거쳐 환급이 이루어지는 점 이용에 참고하여주세요! 투자상품은 안전한 투자를 위해 증권사를 거쳐 해당하는 각 기관에서 자금을 관리하고 있습니다. 그에 따라 소요되는 기간이 발생하는 부분인 점 참고하여주시길 바랍니다. 증권사 앱을 통해 매매내역 확인이 가능한데요, 카카오톡 고객센터로 연락주시면 고객님의 해지 내역을 확인하고 안내 드릴 수 있으니 편하게 연락해주세요!"
fa7a5c27-61b3-4c81-bf20-2d99ad714b16,자산관리시작하면 계약체결진행되면 해지변경 불가합니다 최10일까지만 기다리는문구만 보고있어야되네요..,1,2021-02-08 00:30:52,"안녕하세요, 찐너굴 고객님 :)
펀드 혹은 연금상품에 투자를 시작하신 것으로 예상되네요! 일반적으로 국내에서 거래하는 모든 펀드의 경우는 주문이 진행되게 되면 주문결제가 완료될 때까지 해지/변경이 불가능하게 설정되어 있습니다.
이는 보통 영업일로 3~4일 정도가 소요가 되며, 체결 완료 이후에는 정상적으로 해지를 진행하실 수 있습니다.
조금 더 상세한 도움을 드리기 위해 카카오톡(http://pf.kakao.com/_xcixfWC/chat)으로 연락주시면, 정확한 상황을 공유드리도록 하겠습니다! 감사합니다."
ddda909a-9776-494f-87d5-4991d3a1fc08,네트워크 분석도구 깔려있다고 실행도 못하는게 보안의 기본자세입니까...? 킨컷도아닌데..?,1,2020-09-05 11:52:57,"안녕하세요, 촬쓰 고객님 :)
이용에 불편을 드려 죄송합니다. 증권사의 내부 데이터를 전송받고 있는 파운트 앱의 특성상 앱실링 서비스를 의무적으로 사용하고 있습니다.

저희의 판단과는 별개로 앱실링 서비스에서 설치를 제한하는 프로그램의 경우 앱 사용이 안되는 문제를 가지고 있습니다.
촬쓰 고객님을 포함한 모든 고객님들의 자산을 안정적으로 관리해드리기 위한 노력이니 만큼 양해를 부탁드립니다.

카카오톡(https://fount.pub/talk) 을 통해 사용 중이신 패킷분석도구의 이름을 알려주시면 앱실링 서비스 측에 다시 한번 검토를 요청하도록 하겠습니다!

추후 문제가 해결되실 경우 평점상향 또한 정중히 부탁드립니다."
ed376324-4eea-483b-924d-6bbcf9183fbd,현재 약 180일 투자중 상황. 파운트 : 현재 -1.6% 최고 수익률은 2% 정도 됐던 것 같고. 같은날 같은금액으로 시작한 다른인공지능 투자어플 : 현재 +6.4% 최고 수익률은 9% 정도. 파운트 인공지능 능력부족???,1,2021-10-06 13:21:26,"안녕하세요, rokarmy 82 고객님 :) 수익률에 대한 아쉬운 마음을 담은 리뷰를 남겨주셨네요. 로보어드바이저사마다 전략이 각기 다르며 그에 따른 수익률 차이가 발생할 수 있습니다. 만족스러운 성과를 만들어드리지 못해 죄송합니다. 다만 파운트에서 제공해드리는 포트폴리오마다 권장되는 투자 기간이 있으며 다양한 요인으로 인해 변화하는 시장 사이클이 반복될수록 포트폴리오의 성과가 좋아질 수 있게 구성되어 있는 점 참고해주시면 감사하겠습니다. 보다 자세한 상담이 필요하실 땐 카카오톡 고객센터로 연락주시길 바랍니다."
f98f1df6-e0f2-4739-938f-4cc140f189c7,다 했는데 왜 마지막에 파운드 전용 계좌가 맞지 안데요... 그래서 돈을 못 넣고 시작을 못 했습니다.,1,2021-05-16 15:52:00,"안녕하세요, 김산아 고객님 :) 투자계좌 개설과정 중 불편을 겪고 계시는 군요. 상황확인 후 해결 절차 안내를 도와드릴 수 있게 해당화면을 캡쳐해 카카오톡 채널로 보내주세요."
39f8be03-1dd9-4746-b177-671ea8f6043b,리밸런싱 발생 했다고해서 추가 매수를 하던지 매도를 하라고 문자와서 매도 했더니 36만 납입했던 금액이 3개월만에 12만원 마이너스라니요ㅜㅜ 인공지능투자 절대하지 마세요. 순전히 사기같아요,1,2021-02-11 22:40:56,"안녕하세요, 진찐남 고객님 :)
아마도 리밸런싱 때 환매되는 자산이 12만원이라는 것을 오해하신것 같습니다 ㅎ
파운트 고객 중 말씀하신 수준의 수익률인 고객은 한분도 계시지 않으니 안심하시고 카카오톡(http://pf.kakao.com/_xcixfWC/chat)으로 연락 주시면 상세한 확인 후 설명을 드리도록 하겠습니다: )"
4743a8f1-0c74-4cd0-b62a-9d6a63729f84,"파운트 시작한지 3주정도 됩니다 일주일정도 지나보니 100원도 안되게 수익이 났다고 하더니 그후에 몇백원,, 지금은 오히려 제가 넣은 원금에서 마이너스---- 처음에만 투자내역이 뜨떠니 지금은 투자상황 전혀 알수 없고, 출금도 어떻게 어떻게 하는지 공지되여 있지 않고,,, 출금하고 싶습니다 속은 느낌 드네요.... 조금 투자해보고 잘 되면 투자 늘릴 생각이였는데,, ㅠ 출금 도와주세요!!!",1,2021-05-12 22:22:46,"안녕하세요, 정현화 고객님 :) 투자내역은 파운트 앱 실행 후 '나의 계좌'에서 확인을 원하는 상품을 선택 해 하단 자산현황에서 확인해보실 수 있습니다. 아시다시피 파운트에서는 고객님의 안정적인 투자를 위해 증권사 계좌를 활용하고 있어 출금 절차는 파운트 앱 내 계약 해지 → 일정 기간 환매기간을 거친 이후 증권사 앱을 통해 원하는 계좌로 이체하는 과정으로 이루어져 있습니다. 자주 묻는 질문을 통해 출금 및 해지 방법 확인이 가능하시며 앱 내 1:1 문의하기를 통해서도 챗봇 또는 상담원 연결이 가능하니 편한 방향으로 확인 후 원하는 처리를 진행하시길 바랍니다."
2f697f0b-84a3-4d0e-8020-f69b801b7e98,잠금해제장면에서 간편비밀번호 눌렀는데도 안넘어가네요..,1,2020-02-21 09:35:34,"김민지님. 불편을 드려 죄송합니다.
기존 앱데이터로 인해 해당 증상이 발생하는데, 아래 조치로 해결 가능합니다.

설정- 애플리케이션- 파운트 선택- 저장공간- 데이터 삭제
조치 후 앱에서 본인인증 진행하시면 지문/비밀번호로 로그인 가능합니다.

조치 후에도 문제가 발생할 경우, 고객센터(1833-4656)나 카카오채널(http://pf.kakao.com/_xcixfWC/chat)로 알려주시면 신속하게 처리해드리겠습니다. 불편을 드려 다시 한 번 사과드리며, 이후에는 원활한 업데이트가 될 수 있도록 만전을 기하겠습니다.

문제가 해결되었다면 잘하라는 의미로 별점 조정도 조심스럽게 부탁드리겠습니다."
eb168a63-e0da-4e1f-b518-4306cce8ed01,1년 지나고 약 한달 지나서 해지할려고 하니 1년되자마자 칼같이 수수료 떼가더니 1년 지나고 약 한달 지나 해지할려니까 또 떼갈려고 하네... 칼만 안들었지 강도임 완전 뭐 얘네들은 손해보는 장사는 안하니까... 타 업체랑 경쟁하지 않아도 어차피 아무런 손해없이 수수료만 챙겨도 되니까..,1,2021-12-17 19:20:48,"안녕하세요, Yong Hak Jeong 고객님 :) 업데이트 된 리뷰에 대해 답변드립니다. 현재 파운트는 프로모션을 진행하고 있어 연수취방식이 아닌 해지시 1회 수취로 성과보수 수취를 진행하고 있습니다. 만약 수수료가 이중으로 부과된 부분이 있다면 환불조치를 진행해드리고자 하니 카카오톡 고객센터로 꼭 연락주시길 바랍니다."
