title,review,rating,date,developerResponse
그냥 코스피 지수에 투자하는게...,인공지능이 지수 보다 실적이 안좋음...지수 떨어지면 같이 떨어지고 올라가면 같이 올라가는...저는 10% 손해보고 빠져서 개인적으로 주식투자해서 메꿨네요.,1,2020-08-03 15:22:32,"안녕하세요, 핀트 고객센터입니다. 우선, 기대하셨던 수익률 성과에 못미친 점 아쉽습니다. 
글로벌 자산배분을 하는 핀트투자 특성 상 장기간 호흡으로 봐주시길 권장 드립니다. 앞으로도 고객의 자산을 소중하게 잘 운용할 수 있도록 서비스 개선에 힘쓰도록 하겠습니다. 이용하시는 중 문의사항 및 제안의견은 언제든지 당사 고객센터(1644-8880)로 연락주시기 바랍니다. 감사합니다. "
아 신분증 진짜,차라리 수동촬영이라도 되던가 아무리 해도 인식을 못해요. 검은 배경에 빛반사도 없고 정면인데 왜 인식을 못하나요? 촬영 버튼도 없고 오롯이 자동촬영인데 짜증나서 못하겠네요,1,2020-09-02 13:12:01,"안녕하세요, 핀트 고객센터입니다. 우선, 저희 핀트 서비스를 이용 해주셔서 감사합니다. 모든 절차가 비대면으로 진행되는 서비스와 본인인증 특성 상, 수동 처리 방법 지원이 어려운 점  있지 않은 점 양해 부탁드립니다. 신분증의 컨디션에 따라서도 조금씩 다른 경우도 있는데요. 운전면허증 보다는 주민등록증이 훨씬 잘 진행되니 재시도에 참고 부탁드립니다. 감사합니다.  "
앱 종료되,아이폰에서 오늘 업데이트되었다고 해서 업뎃했는데 실행시키면 그냥 꺼지네요. 여러번 실행시켜도 죽어요. 토요일 밤이라서 그런가요? 일단 실행은 되어야 되는 거 아닌가요...,1,2020-01-04 14:56:16,"안녕하세요, 핀트 고객센터입니다. 앱 실행에 어려움 겪고 계신걸로 보이는데요. 우선, 조금 더 정확한 상황 파악으로 이슈 확인 및 관련 응대가 가능할 것 같습니다. 불편하시더라도 당사 고객센터(1644-8880) 혹은 고객센터 이메일(support@fint.co.kr)로 추가연락 부탁드립니다. 감사합니다. "
도대체 출금을 어찌하라는 건가요,어떻게 빼는지 가이드도 없고 등록만 겁나 쉽고 가이드를 좀 제공해봐요 출금할때는 OTP가 갑자기 필요해요? 증권사를 가야하나요? 그런건 왜 사전 공지가 없어요 돈을 빼주세요 쫌,1,2019-12-19 06:42:55,"안녕하세요, 핀트 고객센터입니다 🙇‍♀️우선, 저희 핀트 앱을 사용해주셔서 감사드리며 출금 절차에 대한 안내가 미흡했던 점 사과드립니다. 우선, 고객님이 보유하신 증권사 계좌, 출금 신청 금액, 신청 시점에 따라서 안내가 상이할 수 있습니다. 고객님의 정확한 계좌상태 확인 후 알맞은 답변을 드릴 수 있도록, 당사 고객센터(1644-8880)로연락 주시면 감사하겠습니다. 참고로, KB증권의 경우 핀트 앱 내에서 ""입출금 계좌"" 등록 후 직접 입금/출금 처리를 핀트 앱 내에서 하실 수 있으니 서비스 이용에 참고 부탁드립니다. (대신증권의 경우 2020년 초 제공될 예정입니다.) 감사합니다. "
미국 앱스토어에는 업로드도 안하는 한심한 앱,게다가 문자인증 으로 인증절차를 만들어서 세컨폰으로 한국 앱스토어 쓰는 사람은 이용도 불가능.,1,2022-02-11 05:49:21,"안녕하세요, 핀트 입니다. 우선 핀트 이용에 불편을 드려 죄송합니다. 핀트 투자를 위해서는 증권사 비대면 계좌 개설이 필요합니다. 현재 증권사 계좌 개설은 국내 거주중인 대한민국 국적의 만 19세 이상 성인에 한해 가능합니다. 이에 미국 앱스토에는 업로드하지 않는 점 양해 부탁드립니다. 또한, 금융서비스 고객 보안을 위해 휴대폰 본인 인증이 필요하며, 휴대폰 본인 인증 없이 앱 로그인은 불가합니다. 보안을 위해 필요한 절차로 고객님의 이해 부탁드립니다. 추가적인 문의사항이나 궁금하신 점 있으실 경우 당사 고객센터(1644-8880)로 연락 주시기 바랍니다. 감사합니다."
어플이 실행이 되지 않습니다,다른 어플은 정상적으로 실행되고 네트워크 상태도 정상인데 계속해서 네트워크 상태가 불안정하다며 접속이 되지 않고 있습니다.,1,2021-03-16 13:57:01,"안녕하세요, 핀트 고객센터입니다. 먼저 이용에 불편을 드려 죄송합니다. 3/16 23시부터 23시30분까지 30분 정도 접속 장애가 있었으며, 바로 조치하여 정상 접속이 가능하였는데요. 해당 시간대에 접속을 시도하면서 이용이 안되셨던 것으로 생각됩니다. 이용에 불편을 드린 점에 대해 사과 드리며, 재발 방지를 위해 조금 더 세심한 노력을 하도록 하겠습니다. 추가 문의사항이 있으신 경우 핀트 고객센터(1644-8880)로 연락 주시기 바랍니다. 감사합니다."
수익률 0%,투자금 천만 원 입금 후 몇 달이 지나도 수익률 거의 없는 상태로 유지하더니 마이너스까지 가네요 이걸 투자 앱이라고 만들었나요?,1,2021-10-14 06:01:38,"안녕하세요, 핀트 입니다. 핀트서비스를 믿고 큰 금액을 투자해 주셨는데 수익률이 좋지 않아 안타까운 마음입니다. 핀트 투자는 ‘글로벌 ETF 자산배분’ 전략을 중심으로, 주식/채권/원자재 등 자산군에 분산투자하게 되는데요. 이러한 전략 특성 상 해당 자산군들의 시장 흐름을 어느 정도 따를 수 밖에 없으며, 단기적인 증시 움직임 등에 영향을 받게 됩니다.최근 증시의 흐름이 좋지 못 하면서 마이너스 상태인 것 같은데요. 운용에 있어 단기 수익률을 추구하거나 단기 트레이딩에 치중하지는 않으며, 중장기적인 시각에서 포트폴리오를 구성하여 운용하고 있습니다. 포트폴리오의 위험 대비 수익률을 안정적으로 가져가는 글로벌 자산배분 투자는 투자 기간이 길어질수록 손실 확률도 낮아지게 되니, 보다 긴 호흡으로 지켜봐 주시기를 바라겠습니다. 감사합니다."
신분증 인식성공률 극악의 난이도,대체 어떻게 촬영하면 신분증 인식이 가능한지 의아한 수준이네요.1시간을 장소를 옮겨가며 찍어도 인식이 안되서 포기.,1,2020-06-10 00:23:54,"안녕하세요 고객님, 핀트 고객센터입니다. 모든 과정이 비대면으로 이뤄지는 서비스 특성상, 기준이 다소 타이트 한점이 있습니다. 다만, 안전한 인증을 위한 목적으로 이해해주시면 감사하겠습니다. (비대면 계좌개설 절차 상, 신분증 인증은 계좌개설 시 증권사로 전달되는 정보로 당사에서 수동 진행이 어려운 점 양해 부탁드립니다.) 참고로, 신분증을 대비되는 배경(흰, 검정)에 두고 촬영하시면 조금 더 수월한 진행이 가능합니다. 감사합니다. "
뭐,제대로 설명도 안해주고 뭘 믿으라는건지... 게다가 돈 다시 빼는것도 2주 넘게 오래걸리네요. 다운받지 마세요 후회함,1,2020-05-04 09:25:07,"안녕하세요, 핀트 고객센터입니다. 우선, 저희 핀트 서비스를 이용해 주셔서 감사합니다. 핀트는 언제든지 원하실 때, 해지 수수료 없이 ""해지"" ""중지"" 신청이 가능합니다. 원화 투자의 경우 최대 4영업일, 달러 투자는 최대 6영업일이 소요되니 이용에 오해 없으시길 바랍니다. 참고로, ""보유종목 청산"" - ""결제"" - ""환전""  - ""정산"" - ""출금"" 순으로 절차대로 진행되기에 별도 출금일 조정은 불가피한 점 양해해 주시기 바랍니다. 감사합니다. "
별점한개,계좌 연결해놨다고 다른 어플에서 매수한걸 자기 멋대로 매도한다음 다시 핀트앱에서 매수한다고 하던데 이게 말이 되는건가...별점한개요,1,2020-12-14 10:42:01,"안녕하세요, 핀트 고객센터입니다. 핀트 운용 중 직접 매매를 하신 것으로 생각됩니다. 핀트 투자는 투자일임계약에 따라 고객님의 계좌 전체 자산을 시스템 운용 하는데요. 같은 계좌에서 주식 등을 직접 매매하시는 경우 핀트 투자의 운용과 충돌이 발생합니다. 이에 핀트 투자의 운용에 의해 매수한 주식을 매도하고 운용에 맞는 종목으로 매수하여 운용하게 됩니다. 동일한 계좌에서 핀트 운용과 고객님의 직접매매 등이 혼재 되어 이용은 어려운 점 양해 부탁 드리며, 직접 운용 등을 위해서는 일임계약의 해지가 필요하오니 자세한 사항은 고객센터(1644-8880)로 문의하여 주시기 바랍니다. 감사합니다.   "
업데이트가 안됩니다,"안그래도 매일 돈만 까먹고있던데
이젠 들어가볼수도없네요
이건 뭐 하아.
욕도 안나옵니다.",1,2020-03-29 05:48:42,"안녕하세요, 핀트 고객센터입니다. 앱 업데이트 단계에서 진행이 어려우신 걸로 확인 되는데요. 강제 업데이트에 해당하지 않는 경우, 업데이트 팝업 시 취소를 선택하면 진입이 될 수 있습니다. 진입이 되지 않는 경우, 당사 고객센터(1644-8880)로 연락 주시면 증상 등을 추가 확인하여 지원하도록 하겠습니다. 감사합니다."
4일 만에 6만원 날렸다,와 너무 한 거 아님. 4일 만에 6만원 손실! 이 리뷰 보시는 분들 절대 하지 마세요,1,2021-08-05 05:09:00,"안녕하세요, 핀트 고객센터입니다. 핀트서비스를 믿고 투자해 주셨는데 수익률이 좋지 않아 안타까운 마음입니다. 핀트 투자는 ‘글로벌 ETF 자산배분’ 전략을 중심으로, 주식/채권/원자재 등 자산군에 분산투자하게 되는데요. 이러한 전략 특성 상 해당 자산군들의 시장 흐름을 어느 정도 따를 수 밖에 없으며, 단기적인 증시 움직임 등에 영향을 받게 됩니다. 또한, 운용에 있어 단기 수익률을 추구하거나 단기 트레이딩에 치중하지는 않으며, 중장기적인 시각에서 포트폴리오를 구성함을 이해해 주시기 바랍니다. 포트폴리오의 위험 대비 수익률을 안정적으로 가져가는 글로벌 자산배분 투자는 투자 기간이 길어질수록 손실 확률도 낮아지게 되니, 보다 긴 호흡으로 지켜봐 주시기를 바랍니다. 추가적인 문의사항이나 궁금하신 점 있으실 경우 당사 고객센터(1644-8880)로 연락 주시기 바랍니다. 감사합니다."
수익율 실화입니까?,6개월 운용하였습니다. 손실을 감수하는 높은 투자수익형으로 해도 은행이자 수준의 수익률입니다. 은행은 손실이 없으니 마음이라도 편하죠.,1,2021-03-22 10:07:37,"안녕하세요. 핀트 고객센터 입니다. 핀트 투자는 전략적으로 글로벌 자산배분을 추구하며, 주식/채권/원자재 등 고른 자산군의 ETF를 대상으로 분산투자 합니다. 증시 혹은 개별 주식 투자 대비 낮은 기대 수익과 낮은 변동성으로 안정성에 보다 주안점을 둔 투자 방식입니다. 또한 투자 전략 특성상 단기 대응보다는 중장기 대응에 초점을 두며 중장기적으로 꾸준히 수익을 쌓아나가는 것을 목표로 하고 있습니다.단기적인 수익률 보다는 긴 호흡으로 함께해 주시면 감사하겠습니다. 혹시 이용 중 문의사항 및 제안의견은 당사 고객센터(1644-8880)로 연락 주시기 바랍니다. 감사합니다."
투자 중단했는데 돈은 어디갔을까요,"투자 기간중 계속 손해만 보길래
투자 중단을 하고 11월 7일인가 해제 된다길래
기다리는데 돈은 어디갔을까요",1,2020-11-07 03:01:58,"안녕하세요, 핀트 고객센터입니다. 계약 해지 신청 시 절차에 따라 보유자산 청산 - 결제(거래소 규정에 따라 2~3영업일이 소요됩니다) - 정산 및 출금의 순으로 진행되는데요. 해지 자산 출금 시 앱 내 연결 은행계좌가 있으신 경우 해당 계좌로 간편 송금을 해드리고 있습니다. 다만, 해지 신청과정에서 직접출금을 선택한 경우 증권사 계좌에 투자금액이 남아 있게 되어 해당 증권사 채널(MTS,HTS,홈페이지, 지점내점 등)을 통한 직접출금의 방법으로  출금 가능합니다. 추가 문의 사항 있으시면 언제든지 당사 고객센터(1644-8880)로 연락 주시기 바랍니다. 감사합니다."
꾸준히 적자만 내서 일단은 1점.,지금까지의 결과가 좋다고 할 수는 없네요.,1,2021-03-25 06:36:42,"안녕하세요, 핀트 고객센터입니다. 핀트서비스를 믿고 투자해 주셨는데 수익률이 좋지 않은 것 같아 안타까운 마음입니다. 핀트 투자는 ‘글로벌 ETF 자산배분’ 전략을 중심으로, 주식/채권/원자재 등 자산군에 분산투자하게 되는데요. 이러한 전략 특성 상 해당 자산군들의 시장 흐름을 어느 정도 따를 수 밖에 없으며, 단기적인 증시 움직임 등에 영향을 받게 됩니다. 또한, 운용에 있어 단기 수익률을 추구하거나 단기 트레이딩에 치중하지는 않으며, 중장기적인 시각에서 포트폴리오를 구성함을 이해해 주시기 바랍니다. 포트폴리오의 위험 대비 수익률을 안정적으로 가져가는 글로벌 자산배분 투자는 투자 기간이 길어질수록 손실 확률도 낮아지게 되니, 보다 긴 호흡으로 지켜봐 주시기를 바라겠습니다. 추가적인 문의사항이나 궁금하신 점 있으실 경우 당사 고객센터(1644-8880)로 연락 주시기 바랍니다. 감사합니다."
일주일 만에 - 22%,"성장형 투자성향 이라고 손실 나야 4% 라고 했는데

-5~6% 유지 하더니 최근 -22% 찍고 

그냥 손절합니다 ㅜㅠ",1,2020-03-13 01:46:26,"안녕하세요, 핀트 고객센터입니다. 최근 코로나19로 인하여 대부분의 자산군이 폭락하는 상황에서 그 영향을 모두 피할 수는 없었으나, 포트폴리오의 구성의 안정성에 최대한 집중하고자 합니다. 시장의 하락과 반등에 대해서도 대응하여 적절한 자산 재조정을 해나갈 예정인데요. 다만, 핀트 투자의 성격 상 단기 대응 보다는 중장기 대응에, 특정 테마 추종 보다는 자산배분에 집중하니 이에 대한 이해를 부탁드리며, 투자 시 손실 확률은 장기 투자를 하실수록 점점 줄어드니 보다 긴 호흡으로 바라봐 주시면 감사하겠습니다. 감사합니다. "
앱안열리는데 어케 해야하나요?,앱 처음에 로딩후에 하늘색화면에서 멈춰있습니다,1,2022-01-06 09:25:08,"안녕하세요, 핀트 입니다. 우선 핀트 이용에 불편을 드려 죄송합니다. 핀트 앱 로그인 과정에서 이슈는 확인되지 않습니다. 고객님께서 남겨주신 내용만으로는 고객님 정보가 확인되지 않아 원인파악 및 처리 방법에 대한 안내가 어려운데요. 다소 번거로우시더라도 핀트 고객센터(1644-8880)로 연락 주시면 확인 후 안내 드리도록 하겠습니다. 즉각적인 도움 드리지 못 하는 점 고객님의 양해 바랍니다. 감사합니다."
지금 업뎃하고나서,어플이 안들어가져요.... 왜이런건가요 ㅠㅠ 해결좀 빨리 부탁드려요,1,2020-06-01 03:20:03,"안녕하세요 고객님, 핀트 고객센터입니다. 먼저, 핀트 서비스 이용에 불편드려 죄송합니다. 6/1일 핀트의 일부 시스템 응답이 다소 느린 상황이 있었는데요. 접속이 느려 접속불가로 보이는 경우도 있었을 것 같습니다. 현재 이슈가 해결되어 지금은 정상적으로 실행되고 있으니, 다시 한번 더 확인 부탁드립니다. 만약, 같은 오류가 반복될 경우 당사 고객센터(1644-8880)로 추가문의 부탁드립니다. 감사합니다."
해외 거주자,해외에 거주하는 사람은 한국번호로 본인인증을 할 수 없는데 그럼 계좌개설을 못하는건가요????,1,2020-10-16 00:28:52,안녕하세요. 핀트 고객센터입니다. 비대면 계좌개설 중 인증 방법은 증권사의 정책에 따라 정해져 있는 부분으로 본인명의 휴대폰 번호가 없으면 가입이 불가능 합니다. 이용에 도움을 드리지 못 하여 죄송합니다. 감사합니다. 
나는 그닥,"저랑은 별로 맞지않는거 같네요.
해지신청 했는데 25일 전으로 입금되는 건가요??",1,2020-02-18 10:15:37,"안녕하세요, 핀트 고객센터입니다. 문의 내용을 업데이트 하셨는데요. 해지신청 시, 출금 가능일을 미리보기 화면에서 보여드리고 있습니다. 해당되시는 날짜를 참고 해주시기 바라며, 관련해서는 앱 내에서 별도의 알림이 전송될 예정입니다. 핀트 서비스를 떠나신다니 아쉽지만, 앞으로도 꾸준히 개선하도록 노력하겠습니다. 감사합니다. "
인식불가,신분증 사진을 찍었는데 안되네요. 오류인지 뭐때문인지 모르겠습니다. 확인 부탁드립니다,1,2020-02-29 02:06:27,"안녕하세요, 고객님. 핀트 고객센터입니다. 신분증 촬영 시 1) 어두운 배경에 신분증을 놓으시고, 2) 빛 반사에 유의하여 촬영하시면 성공률이 높아집니다. 혹시 안내에 따라 진행하셔도 인식이 잘 되지 않는다면, 핀트 고객센터(1644-8880)로 연락주시기 바랍니다. 감사합니다."
어플이 네트워크 오류라고 안들어가져요,금융 어플이 안들어가지는건 좀 문제가 있는거 같아요.!,1,2021-03-24 06:31:09,"안녕하세요, 핀트 고객센터입니다. 우선 이용에 불편을 드려 죄송합니다. 3월 24일 15시10분부터 15시45분까지 35분 정도 접속 장애가 있었으며, 바로 조치하여 정상 접속이 가능하였는데요. 고객님께서 해당 시간대에 접속을 시도하면서 이용이 안되셨던 것으로 생각됩니다. 이용에 불편을 드린 점 다시한번 사과의 말씀을 드리며, 고객님의 너그러운 양해 바랍니다. 재발방지를 위해 조금 더 세심한 노력을 하도록 하겠습니다. 추가 문의사항이 있으신 경우 핀트 고객센터(1644-8880)로 연락 주시기 바랍니다. 감사합니다."
해지문제,개설은 쉬운데 해지는 엄청 복잡하네요 그리고 해지신청하면 투자가 멈춰야되는데 처리될때까지 계속 투자가 진행되네요,1,2019-10-02 16:31:36,"안녕하세요. 핀트 고객센터 입니다. 
계약해지 신청 시 처리는 ""원화투자""의 경우 최대 4영업일 후, ""달러투자""의 경우 최대 6영업일 후 완료됩니다. 해지 신청 후 개장하는 시장부터 보유자산의 청산이 진행되는데요. 혹시 진행 중 이상 현상으로 의심되는 상황 발생 시, 핀트 고객센터(1644-8880)으로 바로 연락 주시기 바랍니다. 감사합니다."
가입하기 드럽게 힘들어서 삭제,"비밀번호 유효성에 맞게 넣어도 계속 확인하라함
짜증나서 삭제. 제대로 유효성 체크 하시오",1,2020-02-05 09:14:37,"안녕하세요, 핀트 고객센터입니다. 우선, 핀트 서비스 이용에 불편사항이 있으셨다니 죄송합니다. 핀트가 금융 서비스이기에 고객보호 등을 위한 보안/인증 절차가 있는 점 양해 부탁 드립니다. 구체적인 증상은 해당 리뷰로만은 특정하기 어렵습니다. 해당 이슈에 관련하여 고객센터(1644-8880)로 추가문의 주시면 최대한 지원하여 도움 드리도록 하겠습니다. 감사합니다. "
신분증 인식이 안되네요,"몇십분동안 여기저기 옮겨다니면서 촬영시도했는데 안찍히네요
시도도 못해보고 지웁니다.",1,2020-01-15 05:20:09,"안녕하세요. 핀트 고객센터입니다. 우선, 저희 핀트 서비스에 관심갖고 이용해 주셔서 감사합니다. 🙇‍♀️ 증권사 계좌개설 신분증 촬영 단계에서 어려움 겪고 계신 것 같은데요. 서비스 이용에 불편드리게 되어 죄송합니다. 비슷한 사례로 대부분의 경우 신분증에 빛이 반사되어 인식이 안되는 원인이 가장 주된 원인 인데요. 해당 부분, 주의하셔서 다시 재촬영 시도 해 봐 주시기 바랍니다. 혹시, 촬영 후 다음단계 진행이 안되는 에러가 있으신 경우, 당사 고객센터 (1644-8880)로 연락 부탁드립니다. 감사합니다. "
개노답,어플 시스템 자체가 노답이네요ㄷㄷ 인증하라해서 몇번을 해도 다음으로 넘어가질 않네요 ㅋㅋㅋㅋㅋ로그인 조차안되는 노답 ㄷ,1,2019-12-19 05:27:42,"안녕하세요, 핀트 고객센터입니다. 먼저, 앱 서비스 이용에 불편 겪으신 점 사과드립니다. 핀트 로그인 단계의 인증 절차에서 어려움을 겪고 계신 것 같은데요. 우선, 남겨주신 내용만으로는 고객님의 정보와 정확한 상황을 파악하여 답변 드리기 어렵습니다. 언제든지 당사 고객센터 (1644-8880)로 연락 주시면 관련하여 필요하신 도움을 드리겠습니다. 감사합니다. "
제 계좌를 연동하려고하는데 안되네요...,아니 연동하려고 하는데 제 계좌가 맞는데 자꾸 연동이 안된다고 하면 진짜 속상하네여...,1,2020-12-18 12:27:33,"안녕하세요, 핀트 고객센터입니다. 연결은행 계좌 등록이 잘 안 되시는 것 같은데요.
아래 내용을 확인하여 주시기 바랍니다.
1) 지역농협 계좌는 등록이 불가능 합니다. 농협계좌인 경우 지역농협 계좌 여부를 확인하여 주시기 바랍니다.
2) 휴대폰번호 등을 이용한 평생계좌번호는 등록이 불가합니다. 실제 은행계좌번호로 입력해 주시기 바랍니다.
3) 당사 등록된 고객명과 은행 예금주명이 상이할 경우 등록이 불가합니다. 사업자계좌 등의 사유로 예금주명이 다른지 확인하여 주시기 바랍니다. 
위 사유가 아님에도 등록이 안 될 경우 추가 확인이 필요하오니 핀트 고객센터(1644-8880)로 연락 주시기 바랍니다. 감사합니다.  "
20만원 넣어서 이틀만에 2만원 까임,"해지 신청 했는데 20일 출금된대!
계산대로면 하루에 만원씩 까져서
20일 되면 3만원 남겠네 ^_^",1,2020-03-13 01:13:34,"안녕하세요. 핀트 고객센터입니다. 우선, 저희 핀트를 이용해 주셔서 감사합니다. 해지 신청 시 자산청산 - 청산금액 결제 - 환전(달러투자의 경우) 등이 필요하기에 절차상 시간소요가 불가피한 점을 이해해 주시기 바랍니다. 감사합니다. "
벌써 11퍼 떨어짐 ㅋㅋㅋ,데이터 축적해서 투자하는겅데 지금 데이터 모으는 중인듯 코로나때문에 새로운 데이터 개이득..ㅋㅋㅋㅋㅋㅋㅋ 제 데이터 잘 쓰세요 전 회수 처리함 아오...,1,2020-03-12 09:36:23,"안녕하세요. 핀트 고객센터입니다. 최근 며칠간은 코로나19로 인한 글로벌 증시 하락이 깊은 상태입니다. 핀트 투자 또한 증시의 단기적 하락을 피할 수 없는 상황이나, 인공지능 엔진이 분산 투자와 안전자산 확보로 손실을 줄이며 운영하고 있습니다. 핀트 투자 성격상 단기 대응 보다는 중장기 대응에, 특정 테마 추종 보다는 자산배분에 집중하니 이에대한 이해를 부탁드리며, 보다 긴 호흡으로 바라봐  주시면 감사하겠습니다."
인증 풀리고 로그인이 안됨,인증이 풀렸는데 본인인증 하라고 해서 인증하려는데 문자인증이 안됨 한 열번 하고 포기.. 돈 어떻게 빼야하나요?,1,2021-08-05 02:37:55,"안녕하세요. 핀트 고객센터 입니다. 먼저 이용에 불편을 드려 죄송합니다. 앱이 업데이트 되면서 보안을 위해 기존 소셜계정 로그인에서 휴대폰 보안인증으로 변경되었는데요. 일부 IOS 이용 고객의 본인 인증 과정에서 일부 문자인증이 원활하게 되지 않아 진행이 안되는 현상이 있었으나, 기존에 문자인증 이력을 삭제 후 재 시도 시 정상적으로 로그인 가능합니다. 다소 번거로우시더라도 문자인증 삭제 후 재시도 부탁드리며, 재시도 이후에도 동일증상 발생 시 핀트 고객센터(1644-8880)로 연락 부탁드립니다. 다시 한번 이용에 불편 드린 점 사과 말씀드리며, 이용 중 불편사항이나 의견 있으시면 언제든지 핀트 고객센터(1644-8880)로 연락 주시기 바랍니다."
돈넣어놨는데 접속이안되요,네트워크 잘되는데 네트워크오류라고 안되네요 자꾸 로그인만 시키고 무한반복되요,1,2020-01-17 10:30:38,"안녕하세요, 핀트 고객센터입니다. 우선, 저희 서비스를 이용 해 주셔서 감사드리며, 불편함을 겪으신 점에 사과 드립니다. 🙇‍♀️ 현재 로그인 단계에서 어려움 겪고 계신 것 같은데요. 고객님이 남겨주신 정보와 내용만으로는 정확한 상황 파악이 어려워 정확하게 회신 드리기 어렵습니다. 번거로우시더라도, 당사 고객센터(1644-8880)로 추가문의 주시면 확인 후 필요하신 도움 드리도록 하겠습니다. 감사합니다. "
